question,answer,img_id,type
những gì đang đi xuống dây chuyền lắp ráp trong nhà máy,donut,502414,0
cặp đèn được treo ở đâu,đường phố,437525,3
những gì chứa đầy những chiếc xe đang được thúc đẩy,xa lộ,568687,0
người đàn ông mặc những gì đang sử dụng điện thoại di động,nón,449402,0
có bao nhiêu người đang cưỡi ngựa trước con tàu,hai,437970,1
những gì có hình dạng như chim lớn trên bãi biển,diều,397151,0
có bao nhiêu người đàn ông đang đi lên cầu thang và một người khác đi xuống cầu thang trên điện thoại,một,249180,1
con mèo đang ngồi ở đâu,cái túi,277070,3
kích thước trung bình đi bộ trong bao vây của mình là gì,con voi,402357,0
màu sắc của vật đang cầm là gì,màu xanh lá,185700,2
màu của tam giác là gì,màu đỏ,333102,2
cái gì đang đi trên một đoàn tàu trên cao,tàu hỏa,406377,0
"điều gì làm từ rau, cà chua và gia vị",bữa ăn,335733,0
cái gì ở trên đĩa,sandwich,354527,0
màu của xe đạp là gì,màu tía,166750,2
màu của ghế là gì,màu xanh dương,132170,2
những gì đang đi trước một người trên giường,con dê,569849,0
những người đang nhìn vào sản phẩm tươi sống ở đâu,cửa hàng,27190,3
những gì đang nằm trên đồng cỏ xanh,gia súc,575624,0
màu của cà vạt là gì,màu xanh lá,445774,2
những gì đang đi qua trạm,xe ô tô,384503,0
có bao nhiêu con cừu trắng ăn rau trên bãi cỏ,ba,329629,1
màu của cỏ là gì,màu xanh lá,209993,2
những gì cần được tái tạo bề mặt và sơn,tường,360772,0
ba bồn và ba gương ở đâu,phòng tắm,298034,3
màu sắc của graffitii là gì,màu đen,366810,2
màu của cây là gì,màu cam,76187,2
màu của đĩa là gì,màu xanh lá,73671,2
có bao nhiêu phụ nữ trong bếp đang giúp nhau nấu ăn,hai,222572,1
màu của sợi là gì,màu xanh dương,15809,2
hai người đông người ở đâu,phòng tắm,359180,3
điều gì tìm thấy một cái gì đó để nhai bên dưới một băng ghế,con chó,441458,0
những gì chứa đầy hoa trên đầu bàn,lọ cắm hoa,517386,0
màu của móng tay là gì,màu vàng,294214,2
những gì đang đậu ở hai bên đường tuyết,xe ô tô,372316,0
các món ăn đang được xem ở đâu,chậu,298573,3
những gì tạo ra màu xanh lá cây dịu,phòng,357957,0
màu của con mèo là gì,màu xám,430142,2
cặp vợ chồng đang ngồi ở đâu,chậu,300072,3
màu của máy bay phản lực là gì,màu xanh dương,107630,2
màu của con bò là gì,màu nâu,557101,2
những gì đang mở ở bàn với điện thoại di động,laptop,417727,0
có bao nhiêu con vật màu nâu đi ngang qua chuồng và ăn cỏ khô,năm,213739,1
mặt trời chiếu sáng ở đâu,phòng tắm,420506,3
những gì đang kết thúc trên đường ray bên cạnh một tòa nhà,tàu hỏa,346517,0
tàu đỏ sáng hướng xuống các đường ray qua những gì,núi,461628,0
hai người đang cưỡi trên một con đường là gì,con ngựa,569767,0
người đàn ông đang giữ một điện thoại thông minh là gì,trường hợp,431746,0
những gì đang trên đường đua của nó và sẵn sàng rời khỏi kho,tàu hỏa,528404,0
một người phụ nữ lớn tuổi chuẩn bị thức ăn ở đâu,phòng bếp,11701,3
hai người cưỡi những gì xuống một lối đi,xe đạp,556205,0
người đàn ông chuẩn bị một cái gì đó ở đâu,phòng bếp,506641,3
người đàn ông chụp một bức ảnh của mình ở đâu,gương,513618,3
có bao nhiêu phụ nữ chơi trong một trận đấu quần vợt chuyên nghiệp,hai,12120,1
đang chơi gì dưới nước,con chim,357824,0
tủ lạnh trắng ở đâu,phòng,488232,3
những gì đang đậu trước bãi đậu xe trước cửa hàng,xe ô tô,485123,0
ngựa vằn và hươu cao cổ ăn gì với nhau,cỏ khô,433243,0
người đàn ông đang chụp ảnh mình ở đâu,phòng tắm,516119,3
có gì đỗ bên ngoài tòa nhà,xe đạp,429497,0
hai con hươu cao cổ đang ở đâu,vườn bách thú,7697,3
bông hồng đơn ở đâu,lọ cắm hoa,341198,3
có bao nhiêu người đàn ông đứng gần nhau chơi wii,hai,512458,1
những con ruồi ở phía trước một máy bay động cơ sinh đôi,con chim,412019,0
những gì ngồi trong sled trong tuyết giả,gấu,537802,0
có bao nhiêu điểm tương phản đánh dấu sự đi qua của các máy bay phản lực này trong sự hình thành,bảy,290192,1
những gì được cài đặt vào tường,lọ cắm hoa,557884,0
bếp trắng cổ điển đang nằm ở đâu,phòng bếp,294934,3
người đang nằm ở đâu,giường,11091,3
ba người đang chơi một trò chơi video ở đâu,phòng,497049,3
hai đứa trẻ ngồi ở đâu,cái lều,480376,3
màu của đàn con là gì,màu đen,138456,2
"những gì nằm trong tuyết, một phần được bao phủ bởi tuyết",trượt tuyết,526133,0
con mèo cuộn tròn ngủ ở đâu,bát,533826,3
người phụ nữ đang cầm cái gì,chiếc ô,340047,0
cái gì đang trưng bày những chiếc bánh pizza tự làm với một cái ly bên cạnh nó,đĩa,440123,0
màu của chiếc bình là gì,màu xanh dương,172669,2
cặp vợ chồng mới cưới ăn gì với nhau,hươu cao cổ,531928,0
cặp vợ chồng đang đi đâu,đường bộ,337682,3
hai đầu bếp bắt đầu công việc chuẩn bị ở đâu,quán ăn,570951,3
những gì phục vụ trên đĩa trắng,pizza,365305,0
những gì đang nằm trên sàn nhìn ra khỏi một cửa sổ,con chó,417846,0
những gì được hình dung là một thứ sáu kết hợp bánh sô cô la ngày 13 và valentine,bánh,550400,0
nam thanh niên mặc quần đùi xanh đánh gì trong trận đấu quần vợt,quả bóng,359356,0
xe tải dozer màu đỏ ở đâu,đường phố,64953,3
những gì đang ngồi đứng trên dây dưới  bầu trời nhiều mây,con chim,580931,0
đẹp những gì với các trung tâm màu cam trong một chiếc bình màu xanh,bông hoa,579453,0
những gì bị chặn một phần bởi cửa gấp,tủ lạnh,575356,0
cái gì đang ngồi trên thảm trước cửa,con mèo,466339,0
có bao nhiêu con hươu cao cổ đứng cạnh một tòa nhà bằng đá nâu,ba,148002,1
có bao nhiêu người đàn ông được hình dung ở quầy thức ăn,bốn,242090,1
nơi trưng bày thú nhồi bông,cửa hàng,375202,3
nông dân thiết lập những gì,rau,471814,0
những gì đang đi qua bụi bẩn gần cây,con voi,385119,0
những gì đang đứng trên bê tông,con chim,509719,0
có bao nhiêu loại rượu khác nhau được xếp hàng trong kính trên bàn ngoài trời,năm,576831,1
hai người đàn ông đang cưỡi ngựa trước trường là gì,xe đạp,403937,0
cặp vợ chồng đang đứng ở đâu,chuồng,507101,3
xe nhỏ nào ở phía sau,xe tải,426372,0
người đó chụp selfie ở đâu,gương,198486,3
những gì chứa đầy đồ nội thất trong thời gian và cùng một phòng khách vào ban đêm,phòng,541606,0
cái gì đang ngồi dưới tay lái của một chiếc ô tô màu đen,con mèo,336372,0
có bao nhiêu thanh thiếu niên đang tạo dáng với ván trượt trên đường phố,ba,331250,1
những gì hiển thị tập trung vào bình lớn,sân vườn,426852,0
những gì đang ngồi trong một sàn gạch có mái ngói trong một phòng duy nhất,nhà vệ sinh,411943,0
màu của xe là gì,màu xanh dương,501957,2
những gì trong một bao vây bởi một cái cây,ngựa rằn,575643,0
chim trắng nhận được những gì từ vũng nước,nước,490125,0
"những gì có một màn hình máy tính, bàn phím và một tách cà phê",cái bàn,482974,0
có bao nhiêu hình ảnh về một người trượt ván trong công viên trượt băng,sáu,124652,1
những gì đang nghỉ ngơi bên dưới bánh xe đạp,con mèo,446409,0
những gì ngồi vào container đi,con chó,495388,0
màu sắc của bức ảnh là gì,màu trắng,196676,2
người đàn ông mặc cà vạt ở đâu,phòng,456309,3
người đàn ông đang chụp ảnh tự sướng ở đâu,gương,224155,3
những chiếc xe cũ đang đậu ở đâu,đường phố,497441,3
những gì đang đi qua một khu rừng,gấu,435240,0
cái gì trong ghế cao màu xanh,gấu,417455,0
chàng trai trẻ với ván trượt lướt qua những gì,xe buýt,577403,0
những gì xe lôi kéo lên đường xuống một con đường tuyết,con ngựa,352007,0
có bao nhiêu bộ điều khiển trò chơi nintendo wii đang ngồi trên bàn,hai,523505,1
màu sắc của giày là gì,màu tía,474356,2
người đàn ông đang nhìn ra khỏi cửa sổ ở đâu,giường,269234,3
những gì đang nhìn lên trên một số bụi cây,hươu cao cổ,480842,0
những gì đỗ bên cạnh nón giao thông,xe tải,572980,0
người đàn ông chuẩn bị thức ăn ở đâu,phòng bếp,347354,3
đầu bếp đang nấu ở đâu trong khi mọi người chờ đợi để đặt thức ăn,phòng bếp,425758,3
tàu màu đỏ dừng ở đâu,trạm,461802,3
cái gì đang cúi mình trên bãi cát trước hàng cây,hươu cao cổ,564142,0
những gì đang đứng với cây phía sau nó,hươu cao cổ,491481,0
những gì đang đứng cạnh nhau trong một bao vây,ngựa vằn,465095,0
có bao nhiêu con hươu cao cổ ngả đầu qua thanh chắn,hai,515390,1
những gì đang ngồi trong phòng khách nhìn ra một cửa sổ,con chó,417846,0
có bao nhiêu người đứng chơi nintendo wii với nhau,hai,54899,1
màu của chiếc tàu là gì,màu đỏ,89446,2
những gì đang nằm trên gối bên cạnh một điều khiển từ xa,con mèo,566998,0
những gì nằm trên ghế sofa,con mèo,454601,0
hai người giữ những gì,ván trượt,437262,0
bồn rửa màu trắng gắn ở đâu,phòng tắm,349059,3
cậu bé ở đâu cưỡi ván trượt của mình,sân,36473,3
màu của gấu là gì,màu đen,454832,2
những gì giữ bó hoa trang trí,lọ cắm hoa,492911,0
có bao nhiêu con ngựa vằn trên bãi cỏ nâu trên bầu trời xám trắng,ba,193889,1
màu của ans là gì,màu vàng,463430,2
những gì đang đi xa bến,con thuyền,428856,0
những gì đang kéo hai chiếc xe tải nhỏ hơn,đoạn phim giới thiệu,448114,0
bông hoa màu xanh bên cạnh quả lê ở đâu,lọ cắm hoa,228376,3
màu của những quả chuối là gì,màu xanh lá,164918,2
nội thất màu tối đang ở đâu,phòng,140108,3
gương và một số cành cây trên tủ quần áo ở đâu,lọ cắm hoa,449693,3
màu sắc của cây cột là gì,màu xanh lá,551829,2
màu của áo là gì,màu xanh dương,72266,2
màu của chiếc bình là gì,màu cam,312430,2
đồng hồ chỉ thời gian được treo ở đâu,trạm,140340,3
con vật nhồi bông ở đâu,hộp,92181,3
cái gì trên bàn gỗ gần một ly và một bình rượu vang,pizza,507887,0
màu của xe buýt / thuyền là gì,màu vàng,54869,2
cặp đôi đang đứng ở đâu,lối đi,572689,3
người phụ nữ đặt thứ gì đó ở đâu trong khi con chó của cô ấy quan sát,lò vi sóng,359363,3
những gì được kéo lên đến bến tàu,con thuyền,464130,0
hai thanh niên đang giữ bộ điều khiển nintendo wii ở đâu ở đâu,phòng,149938,3
người phụ nữ đứng ở đâu,sân bay,296978,3
những gì đang ngồi trên đường ray dưới một tòa nhà,tàu hỏa,354868,0
nơi đẻ bò lớn ở đâu,chuồng,458862,3
"chuối, táo và cam ở đâu",bát,331505,3
cô phục vụ và một người đàn ông đang giữ cái gì vậy,pizza,491008,0
một con mèo cam nằm ở đâu,bát,401705,3
điều gì tương tác với nhau trong một dòng vườn thú,gấu,419604,0
những gì lái dưới cổng vòm châu á màu đỏ,xe ô tô,488573,0
cuốn sách mở ở đâu,vali,473433,3
xe buýt hai tầng màu đỏ và trắng đậu ở đâu,tòa nhà,462057,3
cặp chó nhìn qua một tấm kính bị cấm là gì,cửa,335099,0
có bao nhiêu người lướt sóng bước ra nước vào lúc hoàng hôn,bốn,374848,1
những gì chia với topping trái cây và kem đánh,chuối,351057,0
người đang chụp ảnh mình ở đâu,gương,50988,3
thứ hai người đàn ông chơi với một số con voi là gì,quả bóng,563541,0
màu của ánh sáng là gì,màu đỏ,340109,2
người đàn ông và phụ nữ đang chuẩn bị thức ăn ở đâu,phòng bếp,121226,3
có bao nhiêu phụ nữ đang ngồi trên bàn ăn thức ăn,hai,385744,1
những gì làm bằng gạch với dây leo mọc lên một bên,tòa tháp,376856,0
gia đình đang ăn tối ở đâu,quán ăn,52037,3
người phụ nữ chuẩn bị mái tóc ở đâu,phòng,133905,3
màu sắc của các dấu hiệu là gì,màu cam,454680,2
những gì đứng vững giữa cỏ xanh,vòi,458156,0
màu của con chim là gì,màu nâu,172751,2
con chó đang cưỡi ngựa ở đâu và đeo dây xích,xe ô tô,90827,3
màu của cây là gì,màu xanh lá,236198,2
màu sắc của đôi bốt là gì,màu đen,403592,2
chìm sứ nhỏ được phản chiếu ở đâu,gương,153674,3
"cái gì đang bay vậy, cái đằng sau cái kia",máy bay,353964,0
màu của bảng là gì,màu xanh lá,264709,2
màu của xe máy là gì,màu đen,320292,2
người đang ở đâu với một chiếc ô đen và trắng,ô cửa,281602,3
có bao nhiêu người đàn ông trên sông với ba con voi,năm,369512,1
màu của con mèo là gì,màu nâu,345742,2
những gì đứng gần những con cừu khác trong một cây bút khép kín,con cừu,428562,0
cặp vợ chồng ở đâu,con thuyền,469301,3
người đang giữ một dấu hiệu đi chậm lại ở đâu,áo vest,55882,3
các loại rau đã sẵn sàng để được chọn ở đâu,sân vườn,159309,3
những gì chứa nhiều loại bánh rán,hộp,568675,0
người đàn ông mặc những gì đang làm một số chế biến gỗ,mặt nạ,501122,0
có bao nhiêu con chó trên dây xích với một con chó bằng gỗ,ba,131714,1
đang ăn cỏ khô màu nâu xanh lục là gì,ngựa vằn,488030,0
những gì đang liếm khuôn mặt của người phụ nữ,hươu cao cổ,389453,0
màu của xe là gì,màu đen,109106,2
màu sắc của bông hoa là gì,màu tía,155102,2
nửa cái bánh mì kẹp và mấy trái nho lót giấy ở đâu,cái rổ,536535,3
nhóm người đang ngồi ở đâu,ga-ra,186412,3
con chim xanh đầy màu sắc đang bay xung quanh đâu,lồng,291770,3
có bao nhiêu con hươu cao cổ đang đứng cạnh cái cây gần đường mòn xi măng,năm,279920,1
màu của áo là gì,màu tía,108407,2
màu của các chuyến tàu là gì,màu xanh dương,39556,2
có bao nhiêu hàng với các loại bánh rán khác nhau,ba,191283,1
màu của bầu trời là gì,màu xanh dương,243895,2
những gì đang đứng gần cỏ cao,ngựa vằn,546011,0
màu của chiếc ghế dài là gì,màu cam,59910,2
màu của cái vợt là gì,màu trắng,351888,2
những gì đang ngồi trên một cái bàn được nối với trạm nối,máy ảnh,458810,0
cái gì nằm trong chiếc túi hàng hiệu,con mèo,352549,0
những gì nhỏ và có nhà vệ sinh màu be,phòng tắm,439398,0
có bao nhiêu lát bánh pizza phô mai với một cái nĩa và một con dao,tám,357229,1
cầu thủ bóng chày đang ở đâu,sân vận động,119036,3
người đàn ông đang chụp ảnh tự sướng ở đâu,gương,367321,3
màu sắc của khai thác là gì,màu tía,75954,2
ánh sáng đen tối đã làm gì,phòng ngủ,384651,0
màu của vòi nước là gì,màu đỏ,345914,2
màu sắc của kéo là gì,màu xanh dương,309695,2
màu của xe buýt là gì,màu cam,178242,2
những gì phủ bóng trên bầu trời trong xanh,diều,509270,0
đầu bếp mặc tạp dề ở đâu,phòng bếp,525012,3
màu của bầu trời là gì,màu xanh dương,396572,2
người ở đâu trên đường trước một cửa hàng được theo sau bởi một chiếc xe buýt,xe tay ga,42705,3
có bao nhiêu người đang đứng ở sở thú xem một con voi,ba,518361,1
màu của chiếc đĩa là gì,màu xanh dương,507769,2
nải chuối ở đâu,bát,237762,3
cái gì đậu ở bãi biển bên cạnh một tảng đá,xe máy,373333,0
những gì mở trên bàn với loa,laptop,577091,0
những gì đang dựa vào cột gỗ,xe đạp,453138,0
tàu điện ngầm màu đỏ uốn lượn qua một lớp tuyết bao phủ là gì,đồi,571746,0
màu của nón là gì,màu cam,443188,2
có bao nhiêu con cừu đang thò mũi qua hàng rào dây thép,hai,518335,1
những gì treo lơ lửng trong nhà,máy bay,477700,0
đầu bếp làm việc chuẩn bị thức ăn ở đâu,phòng bếp,83149,3
có bao nhiêu con chim trên mép của một vách đá đang nhìn xuống mặt nước,bốn,374791,1
màu của dòng kẻ là gì,màu tía,478314,2
màu của bánh là gì,màu trắng,580026,2
màu của con chó là gì,màu trắng,377983,2
tuyết bao phủ những gì với một đường trượt trượt tuyết xuống,núi,464207,0
những gì đang ngồi trên cỏ,gấu,539678,0
màu sắc của người đàn ông là gì,màu đen,79090,2
những gì nằm giữa ao và đường cây,băng ghế,395575,0
màu của gấu bông là gì,màu trắng,181649,2
một số bàn gỗ màu nâu xếp hàng ở đâu,phòng,130070,3
có bao nhiêu phụ nữ đang nằm trên hai chiếc giường khách sạn,ba,100579,1
có bao nhiêu con hươu cao cổ đứng trong bụi bẩn trong một khu vực có hàng rào,ba,144,1
cái gì đang đứng trên rãnh,con chim,337139,0
những gì có những con chó nóng và khoai tây chiên với đồ uống,cái mâm,397734,0
người phụ nữ đang làm việc ở đâu,phòng bếp,41404,3
màu của chiếc đĩa là gì,màu trắng,74403,2
ba người phụ nữ đang làm một số thực phẩm ở đâu,phòng bếp,571653,3
những gì bao gồm khoai tây và rau xanh,món ăn,521605,0
màu của xe là gì,màu xanh lá,38022,2
làm gì với máy tính xách tay trên đó,giường,433192,0
những gì trong nước di chuyển,con vịt,572574,0
những gì thiết lập với phần đầu ở phía trước màn hình máy tính để bàn,máy vi tính,374782,0
người đang nằm ở đâu,giường,361905,3
cái gì đang ngồi trên cái quầy màu trắng,lọ cắm hoa,364699,0
brussels mầm và xắt nhỏ những gì trên thớt,bông cải xanh,456377,0
màu của chuối là gì,màu xanh lá,74901,2
những gì xếp hàng tại cơ sở trong nhà ở khu vực đô thị,xe buýt,448964,0
những gì được trồng bên cạnh tường,cây,396274,0
những gì đứng bên ngoài tòa nhà ván gỗ,con cừu,379584,0
hàng bồn vệ sinh ở đâu,nhà vệ sinh,61527,3
có bao nhiêu chiếc giường thêu trong một căn phòng đủ ánh sáng,hai,255631,1
"đâu là nhiều đầu bếp trong những chiếc mũ cao, mũ trắng chuẩn bị bữa ăn",phòng bếp,547475,3
con mèo lông mịn tự ngắm mình ở đâu,gương,252127,3
có bao nhiêu người tạo dáng chụp ảnh khi đang trượt tuyết,năm,240820,1
gấu bông nằm ở đâu,cửa sổ,131509,3
hai người đi xe buýt ở đâu,đường phố,419815,3
những gì bên cạnh cây trên đồng bằng,hươu cao cổ,478406,0
màu của vòi nước là gì,màu đỏ,2148,2
có bao nhiêu người đàn ông mặc áo xanh đang chơi ném đĩa bay,một,178620,1
cái gì đậu chặt giữa những chiếc ô tô trên đường phố,xe tải,377946,0
có bao nhiêu đứa trẻ ăn pizza với người lớn đằng sau chúng,ba,73201,1
nhà vệ sinh đang đặt ở đâu,vòi hoa sen,549209,3
cái gì đây đang giữ một cái bánh sandwich hai tầng,đĩa ăn,430056,0
những gì nằm ngoài xi măng nghiêng gần một ô cửa,nhà vệ sinh,414884,0
màu của áo hoodie là gì,màu tía,268739,2
"bông cải xanh, súp lơ và cà rốt ở đâu, và cà rốt chứa ở đâu",thùng chứa,389731,3
chăn thả gia súc nào gần vỉa hè của các ngôi nhà,con cừu,375783,0
có bao nhiêu người trên ván trượt tuyết đang đi trên con đường đầy tuyết,ba,271641,1
những gì được nấu và sẵn sàng để được ăn,pizza,553075,0
màu của gấu là gì,màu nâu,310748,2
có bao nhiêu con ngựa vằn đang đứng trên một bãi đất trống,ba,154,1
màu của xe chervolet là gì,màu đỏ,101476,2
vận động viên ném bóng chày đang tập ném bóng ở đâu,chuồng,324943,3
cái gì trên đường phố gần cây bụi,xe buýt,533107,0
những gì màn hình ngồi trên đầu bàn cạnh một chai nước đỏ,máy vi tính,450391,0
con chó nằm ở đâu trên ghế,phòng,411208,3
một cái bàn gỗ ở đâu,phòng,90888,3
người đàn ông đặt hai chiếc đĩa ném ở đâu,cái túi,285893,3
những gì hiển thị trên bề mặt gỗ nhỏ,trang thiết bị,463876,0
pizza nhỏ ở đâu,hộp,330451,3
người đàn ông với mái tóc đen trông ở đâu trong khi cầm bàn chải đánh răng,gương,488240,3
màu của cốc là gì,màu xanh dương,265036,2
có bao nhiêu con chó ở dưới nước gần một chiếc thuyền với một người cứu mạng,ba,256229,1
màu của đồng cỏ là gì,màu xanh lá,168001,2
những gì được bao phủ trong hộp bánh pizza mini,gấu,371782,0
có bao nhiêu người cưỡi ngựa trên con đường mòn bên sông,hai,170173,1
con chó đang chờ người chủ ở đâu,cửa,217928,3
gấu teddy ngồi ở đâu,cái ghế,265851,3
màu sắc của người đàn ông là gì,màu đen,152746,2
màu của máy bay là gì,màu trắng,549404,2
những gì chứa đầy nhiều chuối xanh,xe tải,508087,0
có bao nhiêu phần ăn tối được phục vụ trên đĩa trắng,ba,467956,1
màu của xe buýt là gì,màu cam,275168,2
những bông hoa nằm ở đâu,lọ cắm hoa,86468,3
những chiếc bàn chải nhiều màu sắc nằm ở đâu,tách,7559,3
nhóm đàn ông đang ở đâu,hồ bơi,378137,3
những gì đứng cạnh nhau trong một cánh đồng,con voi,381914,0
người cưỡi những gì xuống dốc trượt tuyết phủ tuyết,ván trượt,526371,0
một chiếc xe tải nhỏ màu cam ở đâu,đường phố,393412,3
những gì nhìn về phía trước từ cánh đồng thực vật,gấu,452263,0
cô gái với đôi mắt đen ngồi ở đâu,vali,127660,3
màu của băng ghế là gì,màu đỏ,4571,2
người chơi quần vợt nắm giữ gì,vợt,502982,0
có bao nhiêu chiếc máy bay màu đỏ với làn khói trắng đang bay phía sau họ,bốn,300260,1
cái gì đậu bên đường,xe tải,350084,0
màu của áo là gì,màu nâu,450940,2
những gì đi dọc theo con trâu thông qua địa hình khô,ngựa rằn,459898,0
những chiếc bánh rán hình nhỏ này ở đâu,hộp,424665,3
người đàn ông đang chiêm ngưỡng những bông hoa ở đâu,sân vườn,232886,3
người đàn ông đang chơi đàn ở đâu,phòng bếp,402514,3
những gì được bao phủ trong các giấy tờ với nam châm,tủ đá,531086,0
"có bao nhiêu hình ảnh đồ ăn, một cái bánh mì kẹp tăm",bốn,235790,1
những gì đang đi bộ xung quanh trong nước,con chim,507766,0
xe buýt ở đâu,đường phố,268711,3
những gì được hình ảnh ở chế độ xem bên,phòng bếp,337815,0
những gì nằm trên giường với một ràng buộc trên,con mèo,406395,0
có bao nhiêu người đi xe máy trên đường trước cây xăng và một đống đất lớn,ba,330572,1
cái màn hình nào với bức tượng cái hộp đang nghiêng mình trên đỉnh của nó,laptop,344942,0
có bao nhiêu người đang thưởng thức bữa ăn cùng nhau tại một nhà hàng,sáu,62743,1
cái gì đang ngồi trên cánh đồng,xe tải,360064,0
nhóm người chuẩn bị thức ăn ở đâu,phòng bếp,296360,3
có bao nhiêu con ngựa vằn để chăn thả trên một đồng bằng cỏ,bốn,549366,1
gấu bắc cực trong nước có gì trên một cái lồng,móng vuốt,539067,0
con mèo đang ngồi ở đâu,chậu,320563,3
màu sắc của bông hoa là gì,màu tía,233677,2
những gì đang đứng trong bóng râm,con cừu,427643,0
có bao nhiêu máy bay trong đội hình bay tốc độ trên bầu trời,bảy,423231,1
con chó lớn nằm ở đâu,phòng,222317,3
màu của lửa là gì,màu đỏ,254714,2
cái gì đang đặt trên trên xe,donut,383445,0
cô gái đang đi đâu,trạm,52238,3
nhảy ra khỏi cành là gì,con chim,498381,0
nơi nào nhiều chuối treo trên trần nhà,phòng,574153,3
màu của xe buýt là gì,màu đỏ,114204,2
những gì nằm dọc theo con đường dưới tán cây,băng ghế,347210,0
một người đàn ông ngồi ở đâu,cửa tiệm,514293,3
ba người nội trú băng trượt đang ở đâu để đi xe,bát,547089,3
