question,answer,img_id,type
có bao nhiêu gấu bông nâu với thẻ tên trên chúng,hai,504470,1
con mèo xám nhìn gì,cửa sổ,514668,0
có bao nhiêu con cừu trên cánh đồng với bề mặt đầy tuyết,bốn,69777,1
những gì mang thức ăn cho cửa hàng,xe tải,577223,0
màu của gấu là gì,màu đen,74032,2
"những gì đứng trên bầu trời tươi sáng, rõ ràng",tòa tháp,509551,0
cái gì nằm trong góc bếp,tủ đá,554523,0
trên khay có bao nhiêu chiếc hotdog với ớt một củ hành,hai,266951,1
cái gì đậu trên cành lá,con chim,367433,0
có bao nhiêu con bò cận cảnh và những con khác đang ăn trong nền,một,340157,1
màu của quả táo là gì,màu vàng,282583,2
xe cứu hỏa đậu ở đâu,ga-ra,213366,3
có bao nhiêu phụ nữ xinh đẹp ngồi trên và đứng gần xe máy,hai,385248,1
con mèo đang nằm ở đâu,chậu,111727,3
người phụ nữ đeo mũ bảo hiểm đang cưỡi ngựa là gì,con ngựa,542634,0
có bao nhiêu người phụ nữ đang gọt táo khi đang ngồi,hai,343009,1
màu của chiếc đĩa là gì,màu trắng,82929,2
màu sắc của chiếc váy là gì,màu đen,32544,2
những gì bay trên năm dây điện,máy bay,490294,0
màu của bàn chải đánh răng là gì,màu xanh dương,210416,2
màu của xe buýt là gì,màu vàng,125213,2
màu sắc của giày là gì,màu đen,149143,2
những gì đỗ ở phía trước một tòa nhà gạch đỏ,xe máy,549399,0
anh chàng mặc cái gì cũng giơ chân lên khi đi thang máy lên đồi,bầu trời,348795,0
màu của chiếc ghế dài là gì,màu xanh dương,10346,2
màu của con mèo là gì,màu cam,465495,2
những gì giữ một bông hoa màu hồng trong cửa sổ,lọ cắm hoa,491294,0
những gì đứng trên một bước bên ngoài một cánh cửa mở,con bò,509750,0
màu sắc của sneaker là gì,màu trắng,63345,2
những gì được nấu và sẵn sàng để được ăn,pizza,553075,0
có bao nhiêu con ngựa vằn đang đứng cùng nhau uống nước từ một dòng nước,ba,222921,1
người phụ nữ đeo kính bảo vệ tai đu cái gì,gậy,495985,0
cái gì đang ngồi trên một cái đĩa,pizza,532571,0
đâu là băng ghế dự bị,cửa hàng,295686,3
những gì đỗ trên đường phố,xe ô tô,472598,0
những gì đang chạm vào nhau trên thân cây,con voi,394458,0
người đàn ông tự chụp ảnh của mình ở đâu,phòng,121219,3
có bao nhiêu con hươu cao cổ đi bộ và đứng gần vài cái cây,ba,521678,1
cửa hàng ở góc phố bao phủ là gì,vẽ tranh lên tường,424975,0
có bao nhiêu con bò đực có sừng trên rặng cỏ,ba,492572,1
cô gái đi bên cạnh một cái cây là gì,con ngựa,400950,0
cặp ngựa vằn đang chơi đùa ở đâu,chuồng,294104,3
những gì bên cạnh một bức tường đá,hươu cao cổ,384848,0
màu sắc của tán cây là gì,màu xanh dương,227577,2
người phụ nữ đang giữ gì bởi một phòng tắm,máy ảnh,459921,0
đánh bại những gì đang ngồi một mình trên vỉa hè,hành lý,466575,0
cái gì đang bay trong gió khi ở trên đồng hồ ga xe lửa,cờ,349678,0
màu của chiếc đĩa là gì,màu cam,342724,2
cái gì đang đỗ bên cạnh xe,xe máy,575544,0
hoa hồng trắng và trắng ở đâu,lọ cắm hoa,201299,3
màu của sự lây lan là gì,màu cam,33417,2
những gì cung cổ của nó trong một vỏ bọc sở thú,ngựa rằn,447194,0
người đàn ông thể hiện sự lộn xộn ở đâu,tủ lạnh,40338,3
con mèo mịn đang ngủ ở đâu,bát,533826,3
cái gì đang đặt vòi của nó trên đầu một người phụ nữ,con voi,572347,0
có bao nhiêu người đàn ông xếp hàng trên ván trượt trong rất nhiều,năm,15919,1
màu sắc của các xe bus là gì,màu vàng,177958,2
cái gì đầy ở trên bàn,tách,562735,0
cái hộp đựng thứ nằm bên cạnh một quả chuối và một bát granola,nước,454731,0
công viên ba xe máy ở đâu,ga-ra,153340,3
những gì đang đi xung quanh trên cánh đồng,gấu,471450,0
màu sắc của thung lũng là gì,màu xanh lá,209851,2
có bao nhiêu đơn vị làm lạnh bằng thép không gỉ đang ngồi dựa vào tường,bốn,525865,1
nenon có bao nhiêu đường dừng biển báo trên một con phố,bốn,248496,1
màu của chuối là gì,màu vàng,390797,2
có bao nhiêu con chim đang ngồi cùng nhau trên cành cây,hai,121414,1
màu của mái nhà là gì,màu xanh lá,169845,2
có bao nhiêu người đàn ông cúi xuống cuối con bò bị trói chân sau,hai,149616,1
màu của dấu hiệu là gì,màu vàng,99180,2
coupe của nhà vệ sinh ở đâu,phòng,51949,3
có bao nhiêu máy bay chiến đấu đang bay theo đội hình khói,bốn,461940,1
màu của áo là gì,màu đen,29466,2
có bao nhiêu sĩ quan hải quân từ các quốc gia khác nhau đang cắt một chiếc bánh cùng nhau,hai,22850,1
màu của áo khoác là gì,màu cam,67331,2
những gì đi lang thang xung quanh cánh đồng cỏ,gấu,346334,0
những người mặc áo khoác đang cưỡi trên bãi biển là gì,con ngựa,456015,0
màu của con chó là gì,màu đen,274916,2
người đàn ông cưỡi những gì xuống dốc tuyết phủ,ván trượt,415334,0
cái gì ở trên sàn lát gạch màu xám,bồn tiểu,370444,0
màu của con mèo là gì,màu đen,542946,2
có bao nhiêu con ngựa đang nằm xuống trong khi hai con khác đang đứng trên cánh đồng,một,468193,1
những gì được bao phủ trong vàng sáng,đồng hồ,547221,0
có bao nhiêu người trong một cánh đồng bay một con diều màu vàng,hai,308103,1
pizza lớn đã cắt lát nằm ở đâu,hộp,117578,3
những gì trên cùng với rất nhiều bánh pizza phô mai,quầy tính tiền,514180,0
có bao nhiêu người đứng bên bức tường xanh tươi,hai,44637,1
bốn con hươu cao cổ ở đâu,chuồng,555668,3
những gì đã làm với màu trắng gần như hoàn toàn,phòng tắm,555012,0
những gì đầy hoa hồng bên ngoài,cái nồi,533485,0
có bao nhiêu món bìm bịp đang nấu nướng trên bếp than,tám,148516,1
người phụ nữ trong chiếc áo sơ mi trắng chơi một trò chơi video ở đâu,phòng,551974,3
cái gì đang đỗ bên cạnh đồng hồ đỗ xe trên đường phố,xe ô tô,414882,0
cò đứng ở đâu,đường phố,577146,3
thứ gì được tách ra từ nhà vệ sinh trong phòng tắm,nước tiểu,535643,0
màu sắc của những thứ,màu xanh lá,204420,2
những gì đang ngồi trong món ăn trên bàn,con mèo,548498,0
những gì đỗ trong bãi đậu xe,động cơ,500613,0
màu của chiếc đĩa là gì,màu trắng,250735,2
có bao nhiêu anh chàng đang ngồi trên chân của anh chàng và giữ cổ tay của anh ta,một,218237,1
những gì được đặt trong chiếc bình nhỏ để làm trung tâm bàn quyến rũ,bông hoa,517386,0
có bao nhiêu con hươu cao cổ đứng trong vườn bách thú với cây cối,ba,80974,1
ngựa vằn ăn gì từ đỉnh cây,lá,480345,0
màu của lá là gì,màu xanh lá,72905,2
màu của cỏ là gì,màu xanh lá,193709,2
màu của áo là gì,màu đen,50553,2
đổ những gì một mình trên đường với các tòa nhà và cây trần và cây bụi đằng sau nó,xe tải,454382,0
màu của chiếc thuyền là gì,màu xanh dương,479103,2
màu của món ăn là gì,màu xanh lá,294775,2
màu của động vật là gì,màu đen,335092,2
những gì đứng trên cánh đồng và ăn cỏ,con ngựa,529981,0
những gì đỗ trên đường phố với một vài người xung quanh nó,xe buýt,447569,0
những người trượt tuyết và người trượt tuyết di chuyển xuống,núi,415334,0
những gì đậu trên máng xối trên một tòa nhà,con chim,464248,0
màu của chiếc nắp là gì,màu trắng,441751,2
máy bay bay gì,bầu trời,443450,0
người thanh niên nặn bột thành những quả bóng ở đâu,phòng bếp,20202,3
những gì đang đi trên đường sắt bên cạnh tuyết,tàu hỏa,393478,0
cái gì đang đứng trên rãnh,con chim,337139,0
hai quý ông đứng ở đâu,văn phòng,350386,3
màu của dấu hiệu là gì,màu đỏ,311568,2
cái gì trên đường gần một chiếc xe khác,xe tải,403919,0
những gì được nhìn thấy qua hàng rào liên kết chuỗi,con thuyền,377882,0
hai hươu cao cổ đứng ở đâu,lồng,524531,3
người đang cầm bánh rán ở đâu,cái túi,258725,3
hai người đang chơi ở đâu,cửa hàng,84489,3
"những gì chứa đầy trái cây, rau và đồ nhúng nằm trên đỉnh của một cái bàn",đĩa,478155,0
màu của vòi nước là gì,màu vàng,287228,2
cái gì đang đỗ trên màn hình phía sau kính,xe máy,401550,0
đầu bếp đứng ở đâu,phòng bếp,282889,3
màu của chiếc đĩa là gì,màu cam,561731,2
có bao nhiêu chiếc máy bay đóng thế cùng nhau bay trên không trung,năm,161973,1
người phụ nữ đang làm việc ở đâu,phòng bếp,41404,3
cái gì đang ngồi trên cành,con chim,374551,0
bao nhiêu con ngựa nằm xuống trong khi một con khác đứng gần đó trên một bãi cát ven biển,một,33649,1
có bao nhiêu trường hợp hành lý bao gồm túi vải thô,bốn,32105,1
màu của phòng tắm là gì,màu xanh dương,532509,2
cái gì đang nằm trên bàn trắng,bánh,556608,0
ngồi gì vẫn còn trên đường ray tàu,tàu hỏa,384207,0
"những gì đã được thực hiện, trông giống như khu rừng có bụi bẩn, gấu và cây cối làm từ frosting",bánh,544421,0
người phụ nữ đang ở đâu,phòng bếp,540057,3
những gì được chiếu sáng lờ mờ bởi đèn trong góc,phòng,429593,0
những gì được mặc quần áo và đứng trong một ngưỡng cửa sổ,gấu,474528,0
cái gì bên cạnh màn hình tivi nhỏ,laptop,373574,0
có bao nhiêu quả cam xếp chồng lên nhau trong cái bát màu trắng,bảy,31000,1
cái gì đang ngồi trên băng ghế bị bỏ hoang,con chim,352936,0
"những gì đứng đầu với nấm, bông cải xanh, hành tây và phô mai",pizza,549224,0
những gì đang ngồi trên giường với một tấm chăn trắng,con mèo,553547,0
mèo xám và trắng đang ngủ cuộn tròn ở đâu,bát,16664,3
màu của chiếc đĩa là gì,màu trắng,23158,2
màu của quả bóng là gì,màu xanh lá,445355,2
màu của rau là gì,màu xanh lá,89912,2
màu của vùng đất  là gì,màu xanh lá,574144,2
màu sắc của bông hoa là gì,màu tía,473018,2
cô bé dễ thương ở đâu với mái tóc xoăn,sân,277386,3
những mảnh đồ nội thất búp bê khác nhau ở đâu,phòng bếp,115544,3
ba người đàn ông đang ngồi ở đâu,cửa tiệm,304765,3
cái gì đang đỗ bên cạnh lề đường,xe buýt,558539,0
những gì lộn xộn được định vị ở phía trước cửa sổ,giường,469857,0
máy tính xách tay ở đâu,cỗ máy,275353,3
món ăn của bông cải xanh và các loại hạt chứa ở đâu,bát,99647,3
những gì trong nước bên ngoài lễ hội,con thuyền,527098,0
có bao nhiêu con cừu ngoài đồng đang ăn rơm,năm,31678,1
màu của chiếc xe đang chạy là gì,màu cam,548893,2
có gì đỗ ở phía trước một tòa nhà,xe đạp,435444,0
con chó nâu và trắng mặc những gì,cà vạt,468541,0
có bao nhiêu người cưỡi ngựa trên con đường cát,hai,77061,1
những gì được cập cảng trong khi thời tiết rõ ràng,con thuyền,388880,0
những gì xếp hàng trong hàng bên cạnh máy tính xách tay,chuối,427666,0
hai người mặc những gì,mũ,427341,0
có bao nhiêu người đàn ông tạo dáng chụp ảnh khi họ ngồi trên xe máy của họ,năm,239988,1
những gì chờ đợi để đi du lịch với những chiếc vali hàng đầu,gấu,462953,0
có bao nhiêu người mặc đồ trượt tuyết trong một khu rừng,ba,179188,1
xe tải vận chuyển đến một vị trí khác là gì,xe ô tô,546965,0
những gì bị cắt một nửa trên một tấm,sandwich,528496,0
màu của chiếc tàu là gì,màu vàng,446307,2
màu của biển báo là gì,màu đỏ,87403,2
cặp vợ chồng ở đâu,đường phố,378618,3
cái gì trên bàn thành phố,máy vi tính,521995,0
những gì đứng với đầu của nó xuống trong bao vây của nó,ngựa rằn,551559,0
những gì bên cạnh những con voi khác,con voi,488368,0
những gì nằm trong hộp giấy,donut,497484,0
hai thương nhân chuẩn bị bánh ngọt ở đâu,cửa hàng,73470,3
cái gì đang đi xuống kênh nước,con thuyền,377080,0
những gì đang ngồi bên cạnh một bơm nhiên liệu giả,giường,384111,0
màu của con chim là gì,màu nâu,148474,2
đĩa rau ở đâu,đĩa ăn,421656,3
có bao nhiêu người đàn ông đang làm khuôn mặt buồn cười trong khi một người đàn ông khác cười,một,246084,1
màu của chiếc mũ là gì,màu vàng,438485,2
loài gặm nhấm trong ngôi nhà vật nuôi đang ăn gì,bông cải xanh,354606,0
những chiếc xe kéo được dừng lại ở ga tàu,tàu hỏa,423215,0
những gì chỉ có nhà vệ sinh và bể chứa cho nhà vệ sinh bị treo trên tường phía trên nhà vệ sinh,phòng,411943,0
ngựa nâu và trắng đang ăn một số cỏ xanh ở đâu,chuồng,311957,3
màu của cỏ là gì,màu nâu,407751,2
cô gái mang theo gì dưới cánh tay của cô ấy,diều,397151,0
có bao nhiêu người đàn ông đứng cùng nhau với những chiếc đĩa bay trong tay,bốn,96765,1
hai sinh viên đang đặt ra một bức ảnh với giáo viên của họ ở đâu,lớp học,276735,3
những gì có những gì ở cuối thân của mình,con voi,550872,0
những gì đứng trong xe ngựa hạn chế nhỏ,nhà ở,450577,0
màu sắc của thứ đang hạ cánh là gì,màu đen,225071,2
có bao nhiêu cô gái trẻ đang ngồi trên ghế dài nhắn tin trên điện thoại di động của họ,hai,534162,1
chuối nằm ở đâu,bát,458921,3
con ngựa kéo những gì đi xuống giữa một con đường,xe,524431,0
băng ghế trống và bảng xếp hàng ở đâu ,tòa nhà,532504,3
màu của biển là gì,màu xanh dương,155221,2
phòng tắm với một tấm gương một rèm tắm,tường,395124,0
chàng trai trẻ với ván trượt lướt qua những gì,xe buýt,577403,0
đội chiếc mũ nhựa nhỏ trông có vẻ mệt mỏi,con mèo,339738,0
có bao nhiêu con ngựa vằn rải rác khắp đồng cỏ vào một ngày nắng,sáu,437467,1
người đang giữ gì vậy,điện thoại,506052,0
"máy tính, bàn phím, màn hình và đang ngồi trên bàn làm việc gì",trang thiết bị,374782,0
động vật hoang dã đang ở đâu trên vùng đất,chuồng,383282,3
màu của chiếc xe là gì,màu vàng,520049,2
có bao nhiêu cô gái trẻ đang chải tóc cho một cô gái trẻ khác,một,337164,1
màu của tấm thảm là gì,màu đỏ,327726,2
màu của chiếc giường là gì,màu trắng,417814,2
có bao nhiêu người đàn ông đang cố gắng bắt trò ném đĩa ở công viên,hai,103252,1
", người cũng có những gì",chiếc ô,389258,0
những gì đỗ ở bên đường trong một thành phố,xe buýt,412757,0
cái gì trên đĩa gần một tách cà phê,donut,505899,0
nhà vệ sinh hiện đại nằm ở đâu,phòng tắm,71907,3
cô gái đang sử dụng máy tính xách tay của trẻ em ở đâu,phòng,437184,3
người đàn ông cầm ly rượu để ngửi cái gì,rượu,381682,0
cái gì đang ngồi trên bàn trong lớp học,lò vi sóng,349525,0
có bao nhiêu cô gái trẻ trong trang phục cổ điển đứng gần một con ngựa,hai,11801,1
những gì tách biệt với nhau bằng một hàng rào dây và gỗ,hươu cao cổ,474471,0
cậu bé ở đâu cưỡi ván trượt của mình,sân,36473,3
có bao nhiêu con cừu đứng thành hàng bên cạnh người chăn gia súc của chúng,năm,296573,1
những gì đỗ ở bên đường,xe máy,540187,0
màu sắc của cái dù là gì,màu đỏ,239828,2
những gì đỗ trong đồng cỏ,xe buýt,479556,0
đèn giao thông đang ở đâu,đường phố,391652,3
những gì bao quanh bởi giao thông và đường phố thành phố,bức tượng,393277,0
có bao nhiêu đĩa giấy trắng mỗi cái có một lát bánh pizza đặc biệt trên chúng,ba,50827,1
cái gì chưa đầy hàng tạp hóa và sản phẩm,cửa hàng,579277,0
người đàn ông đứng ở đâu,phòng tắm,53604,3
cá rô có khả năng là gì,tách,430238,0
con chó nằm ở đâu,đường phố,230522,3
những gì đứng trong cánh đồng cỏ,hươu cao cổ,401820,0
người phụ nữ và một đứa trẻ thích gì với nhau,chuối,337563,0
có bao nhiêu lát là tấm chứa pizza pepperoni,một,309539,1
con mèo đang ngồi ở đâu,chậu,567754,3
có bao nhiêu phụ nữ đang tạo dáng với ly rượu,ba,514346,1
những gì được trình bày trên sàn bên cạnh một chiếc vali mở,túi,539419,0
những gì nằm trên một băng ghế công viên trống rỗng,con chim,391029,0
màu của con mèo là gì,màu nâu,22415,2
con thỏ ngồi ở đâu,phòng,508899,3
màu của tường là gì,màu tía,281700,2
tàu cao tốc đi chậm ở đâu,trạm,29253,3
người phụ nữ đặt một số món đồ để cô ấy có thể hòa chúng vào nhau ở đâu,máy xay,575060,3
những gì đang phát triển trong một khu vườn bị lùn bởi lá của nó,cây,410934,0
"cậu bé ở đâu, xem lò nướng",cái ghế,23176,3
những gì phục vụ trên đĩa màu nâu,pizza,360600,0
đầu máy màu vàng và trắng kéo những gì trên đường ray,xe ô tô,434022,0
màu của ánh sáng là gì,màu xanh lá,532779,2
có bao nhiêu chiếc bánh rán bị mờ trong một hộp,năm,102589,1
những gì ôm ấp bên cạnh nhau trên chăn hoa hoa,con mèo,551815,0
những gì đỗ gần một chiếc xe đạp khác,xe máy,538792,0
cái gì vừa có cái đĩa bay,con chó,369541,0
con chim kỳ lạ phản chiếu ở đâu,gương,240713,3
những gì đỗ ở bên đường,xe máy,385428,0
bản vẽ của một con gấu giữ những gì,diều,421437,0
"cảnh xiếc nơi có bao nhiêu samurai đứng thành hàng, trong khi hai con voi đi phía sau họ",năm,81143,1
hai người đứng ở đâu trong tuyết,trang thiết bị,221794,3
những gì đang đứng cạnh nhau bởi những cái cây,hươu cao cổ,344059,0
màu của vòi nước là gì,màu trắng,304065,2
có bao nhiêu người đang ngồi vào bàn với máy tính xách tay và ly nước giải khát,bốn,180778,1
có bao nhiêu người đàn ông đang ngồi dưới ô trên vỉa hè,hai,40083,1
"có bao nhiêu người đang ngồi trên chiếc ghế dài, một người vỗ tay, một người cầm hai bộ điều khiển",ba,267048,1
những gì đứng đối mặt với vẻ khó chịu,gấu,449856,0
có bao nhiêu chiếc ghế dài bằng gỗ ngồi trước khu vực sân trong,hai,465092,1
"những gì đi qua cây cầu, dưới một vòm",xe buýt,420710,0
cái gì đã bày ra trên bàn với một ly rượu trong nền,bữa ăn,334746,0
cái gì đã kéo vào chiếc xe đẩy đứng trước một ngôi đền,con ngựa,508639,0
những gì cho thấy những cái đầu bông cải xanh và mầm brussels nằm trên đỉnh,mặt,456377,0
người đàn ông trong chiếc áo sơ mi trắng và mũ đỏ bắt được gì,dĩa nhựa,409198,0
một người đàn ông châu á mặc những gì,bộ đồ,557447,0
những gì ở phía trước của một ví,điện thoại,384335,0
những gì trông giống như khuôn mặt cười,người giữ,518287,0
đứa trẻ với chiếc găng tay chạy ở đâu,đường bộ,185945,3
những gì đang phát triển bên trong chai màu xanh lá cây,cây,580608,0
hươu cao cổ ăn một số lá là gì,cây,571925,0
gấu bông koala ôm gấu bông koala con ở đâu,cái ghế,239793,3
phòng tắm với gương lớn ở đâu,vòi hoa sen,361638,3
những gì thắp sáng vào ban đêm gần tòa nhà khác,tòa tháp,391648,0
màu của con mèo là gì,màu đen,424760,2
màu của con chó là gì,màu nâu,426947,2
màu của khuôn mặt là gì,màu cam,38896,2
người đàn ông đang cầm gì và đi bộ xuống vỉa hè trong mưa,chiếc ô,379259,0
những gì nhỏ và có nhà vệ sinh màu be,phòng tắm,439398,0
cái gì đang mở trong phòng tối,cửa ra vào,343603,0
người phụ nữ đang ngồi ở đâu,tủ lạnh,465734,3
"con mèo nhỏ, đen ngủ trưa ở đâu",hộp,511148,3
có bao nhiêu người đang lướt sóng trên bãi biển,hai,119139,1
nơi có nhiều loại trái cây trưng bày ở đâu,thùng chứa,7367,3
màu của xe tải là gì,màu đỏ,69393,2
màu của bầu trời là gì,màu xanh dương,292973,2
những gì bên cạnh một đĩa pizza nhỏ,rượu,440123,0
những gì đỗ ở bên đường,xe buýt,439173,0
màu của con mèo là gì,màu xám,554731,2
tmột đồng cỏ con gì ăn một vài ngọn cỏ,con cừu,383039,0
những gì làm từ hoa trên một ngọn đồi,đồng hồ,499903,0
những gì đang nằm trên mặt đất,hươu cao cổ,442894,0
màu của tòa nhà là gì,màu xám,46189,2
nhiều thứ gì treo lơ lửng trên trần của một viện bảo tàng,máy bay,502599,0
những gì chứa đầy các loại rượu khác nhau,tủ đá,521357,0
cái gì đậu bên cạnh một số tòa nhà,xe ô tô,366179,0
những gì đỗ trên vỉa hè gần các tòa nhà nhiều tầng,xe máy,468508,0
màu của bầu trời là gì,màu xanh dương,66005,2
có bao nhiêu con gấu bắc cực lục lọi đống rác trên bãi biển,ba,158326,1
những gì nằm trên cỏ và trừng mắt nhìn vào một cái gì đó,gấu,539678,0
có bao nhiêu chàng trai đang đi dạo trên bãi biển mang theo ván lướt sóng của họ,hai,340038,1
những gì mỉm cười từ vòng vây của nó ở sở thú,gấu trúc,490720,0
hai người phụ nữ mặc những gì đứng gần hàng rào,mũ,423715,0
những gì đang nhìn trên đỉnh đồi,con cừu,541991,0
cái gì đang đỗ trên đường băng lớn,máy bay,393869,0
có bao nhiêu máy bay chiến đấu được thành lập trong một cuộc triển lãm,bảy,206001,1
phục vụ món thịt hầm bông cải xanh ở đâu,bát,508592,3
màu của ghế là gì,màu nâu,465906,2
có bao nhiêu chiếc bánh mì kẹp giấy bị mắc kẹt trong cốc,ba,246641,1
người phụ nữ đang làm việc ở đâu,phòng bếp,391213,3
những gì kéo lên trong tín hiệu giao thông,xe tải,419378,0
pizza lớn với nhiều lớp phủ khác nhau ở đâu,hộp,476380,3
những gì dừng lại ở lề đường trên bãi cỏ với hoa,xe đẩy,395752,0
màu của áo là gì,màu đỏ,52324,2
cái gì nhìn qua gỗ để xem những gì ở phía trước,gấu,378765,0
người phụ nữ mặc một chiếc váy hoa đang giữ gì,chiếc ô,452836,0
những gì di chuyển trong thành phố,xe buýt,571182,0
cái gì đang đứng trên mặt đất cát bên ngoài vào ban ngày với cây cối phía sau nó,con voi,348931,0
có bao nhiêu người phụ nữ đứng trong một nhà bếp gần lò vi sóng và tủ lạnh,hai,307603,1
có bao nhiêu con hươu cao cổ đang vươn lên cao để ăn thức ăn từ một thùng chứa,ba,322897,1
cái gì đang đậu dưới biển báo duy nhất,xe ô tô,523360,0
đứa trẻ nhỏ ngủ ở đâu,giường,560726,3
nhà vệ sinh và bồn tắm ở đâu,phòng tắm,48199,3
cái gì đang nằm trên cỏ,diều,550729,0
màu của xe buýt là gì,màu vàng,149598,2
những gì trên mặt đất khi nước đổ lên đường,vòi nước,387244,0
màu của tường là gì,màu xanh lá,261144,2
một vài đứa trẻ với ván trượt đứng ở đâu,đường phố,546473,3
người dân cưỡi những gì đang đi trên đường,xe đạp,508985,0
hai người phụ nữ lấy những gì với điện thoại của họ,những bức ảnh,493751,0
những gì đứng gần một con cá sấu trên một cánh đồng,ngựa rằn,490749,0
cái gì đang đậu bên hàng rào,xe máy,346259,0
người phụ nữ và một đứa trẻ ở đâu,phòng,137808,3
cái gì đang kéo hai người trên một chiếc xe ngựa trên một con phố,con ngựa,359925,0
cặp ngựa kéo là gì,xe,397135,0
con gì nằm bên trong nôi để ngủ,con mèo,581402,0
cái gì ngồi trên khom lưng trước cửa,con mèo,360943,0
bột được phết ở đâu,chảo,299326,3
có bao nhiêu người phụ nữ đeo lưới che tóc trong nhà bếp,hai,102353,1
có bao nhiêu quả bóng có bao nhiêu chiếc vợt tennis đang cố gắng đánh trúng,một,423481,1
những gì đang nằm trên cỏ,diều,550729,0
những thứ chứa rất nhiều đồ dùng màu đỏ,phòng bếp,527759,0
những gì được nhìn thấy trong bức tranh này,nhà vệ sinh,356351,0
