question,answer,img_id,type
những gì được bao phủ trong graffiti đầy màu sắc,xe buýt,524742,0
những gì đang dựa vào một tòa nhà,gậy,542792,0
màu của chiếc hộp là gì,màu đen,71879,2
có bao nhiêu con voi được nhìn thấy cùng nhau đi dạo trong tự nhiên,hai,430391,1
có bao nhiêu người đứng bên ngoài bên cạnh một chiếc xe tải lớn,hai,214247,1
đĩa nhựa và dây xích ở trên rổ ở đâu,cái rổ,238114,3
có bao nhiêu người đang cưỡi ngựa và hướng dẫn viên,ba,530242,1
cái bình nào bên cạnh những người khác,cây,347648,0
những gì cuộn xuống đường gần ngã tư và một hiệu thuốc cvs,xe tải,419378,0
những gì chứa đầy hai hành lý màu nâu và một con nộm mặc áo sơ mi,phòng,518006,0
màu của chăn là gì,màu xanh dương,104454,2
những gì đầy thỏ và chim,hộp,388014,0
người phụ nữ đang làm bánh rán tươi ở đâu,phòng bếp,105531,3
những gì nằm ở dưới cùng của các bước,đi văng,512223,0
pizza đặt ở đâu,hộp,190537,3
cái gì đang di chuyển trên một bộ đường ray,tàu hỏa,574856,0
những gì đỗ bên cạnh nhau trên giá xe đạp,xe đạp,507249,0
người đàn ông cắt tóc ở đâu,cửa tiệm,277267,3
những gì nằm trên bàn cạnh bàn phím,chuột,447548,0
có bao nhiêu trường hợp phù hợp với các kích cỡ khác nhau bên cạnh nhau,ba,59385,1
màu của dĩa nhựa là gì,màu tía,329012,2
đầu bếp tất cả làm việc để chuẩn bị bữa ăn ở đâu,phòng bếp,30569,3
màu của xe là gì,màu xanh dương,518083,2
người đang nhìn xuống đâu,trượt tuyết,24915,3
những gì đỗ bên cạnh tòa nhà,xe tải,422432,0
mèo đen nằm ở đâu,phòng,540750,3
màu của dĩa nhựa là gì,màu vàng,564483,2
cái gì đang ngồi trên bàn,con mèo,388658,0
bãi xe lửa màu cam và xám ở đâu,trạm,361601,3
cái gì màu đen trong khi cái kia màu nâu và màu vàng,vali,441147,0
những gì đã cất lên trên các bãi biển trên cát,con thuyền,526751,0
những gì đứng trong bãi đất bên cạnh một cấu trúc bằng gỗ,hươu cao cổ,460126,0
có bao nhiêu người trượt tuyết đứng trên đỉnh dốc,ba,35580,1
những gì đang đứng trên đồng bằng,ngựa vằn,548848,0
những gì đang đi qua một số cỏ,bắp chân,482667,0
người ta trộn chất lỏng màu hồng ở đâu,máy xay,401981,3
những gì đang ngồi trên đường ray tàu và gắn vào xe trước nó,xe ô tô,434279,0
cái gì đã xô ngã nó trên một ngọn núi tuyết bao phủ,xe buýt,497791,0
những gì đang đứng bên ngoài gần một số tảng đá,hươu cao cổ,551665,0
có bao nhiêu con chó bị xích đứng cạnh nhau,ba,176474,1
có bao nhiêu người lướt sóng đang mặc bộ quần áo của chúng tôi đang cưỡi trên cùng một con sóng,ba,361592,1
những gì di chuyển xuống đường ray trong bối cảnh ngoài trời,tàu hỏa,357331,0
có bao nhiêu con voi đứng cầm bút ở các điểm khác nhau,hai,270402,1
người đàn ông và một người phụ nữ đang nấu ăn ở đâu,phòng bếp,504257,3
những gì đang được lưu trữ trong lối đi hẹp,xe đạp,570834,0
màu sắc của cực là gì,màu xanh dương,305323,2
những gì đang ngồi trước một cái cây với nhau,hươu cao cổ,422253,0
điều gì ở bên cạnh một con đường gần một chiếc xe cảnh sát,thân cây,434990,0
màu sắc của đi bộ là gì,màu nâu,204806,2
màu của con chó là gì,màu vàng,360165,2
người đàn ông nhắm ai ở đâu,gương,386564,3
người phụ nữ nằm ở đâu,giường,45425,3
ngọn lửa màu xanh lá cây và màu da cam là gì trên con đường gạch,vòi,445766,0
những gì dừng lại trước một người bảo vệ cảnh báo,xe lửa,528811,0
màu của bầu trời là gì,màu xanh dương,370824,2
nhóm người xếp hàng ở đâu,sân bay,189912,3
điều gì làm đẹp cái bàn cho một bữa tiệc,sandwich,448923,0
màu của bộ đồ là gì,màu tía,63703,2
nhóm hoa được phân cụm ở đâu,lọ cắm hoa,518180,3
màu của áo là gì,màu đen,143578,2
màu của con ngựa là gì,màu nâu,27739,2
màu của con chó là gì,màu đen,23594,2
màu của máng là gì,màu xanh lá,223560,2
người đàn ông và một người phụ nữ mang gì ở nhà ga xe lửa,ván lướt sóng,376667,0
hai con cừu ở đâu với quần áo trên,chuồng,162993,3
những gì đứng đầu với phô mai và pepperoni với rau,pizza,434634,0
màu của cà phê là gì,màu đen,369357,2
màu của nhà vệ sinh là gì,màu trắng,143984,2
cái gì nằm trên lưng của một con ngựa vằn khác,ngựa rằn,443591,0
màu của xe buýt là gì,màu xanh lá,257013,2
những gì đánh hơi con mèo trong khi đứng trong tuyết,con cừu,531710,0
những gì được trang trí như chiếc phao với một chiếc ô lớn thay cho mái nhà,xe ô tô,520979,0
những quả cam đang nằm ở đâu,bát,38134,3
người phụ nữ trong chiếc áo sơ mi trắng chơi một trò chơi video ở đâu,phòng,551974,3
những gì đang ăn trong ổn định trong một vỏ ngựa vằn,ngựa vằn,416049,0
người đàn ông đứng ở đâu bên cạnh áo sơ mi,áo vest,153123,3
cái gì ngồi trên sàn gỗ gần đồ chơi mà họ đã phá hủy,con chó,370765,0
có bao nhiêu con ngựa vằn đang đứng gặm cỏ trên cánh đồng,năm,268938,1
cái gì đang ngồi trên cỏ,gấu,373810,0
hoa ngồi ở đâu bên cạnh một cái đầu bãi đậu xe,lọ cắm hoa,459879,3
màu của lá là gì,màu xanh lá,322,2
có bao nhiêu ván lướt sóng đang ngồi trên cánh đồng xanh,năm,273352,1
những gì dường như đang ôm nhau dưới những cái cây,ngựa vằn,487534,0
cái gì đang trên cát,con thuyền,503823,0
những gì nằm trong hồ bên dưới núi,con thuyền,427649,0
mấy cuốn sách gì vậy,bàn phím,364860,0
những gì được bao phủ trong lá nhôm là nướng trong lò,món ăn,344795,0
cô bé đẻ ở đâu,giường,167057,3
có bao nhiêu cô gái đang ngồi trên giường cười nói,bốn,130118,1
người đàn ông cầm những gì phản chiếu trong một tấm gương phòng tắm ,máy ảnh,383606,0
xe tải trắng có cách tiếp cận dấu hiệu gì,cỗ máy,400554,0
những gì ngồi đậu ở bên đường,xe ô tô,526392,0
màu của động cơ là gì,màu xanh dương,394436,2
màu của áo là gì,màu đỏ,48944,2
ba người trượt tuyết lấy những gì nâng núi lên,bầu trời,434618,0
những gì đang đứng đằng sau bụi cây,con voi,534151,0
những gì mở của tàu trắng và đỏ,cửa,547583,0
em bé đang rúc vào đâu,giường,244284,3
người cưỡi trên một con dốc phủ đầy tuyết cầm cọc,ván trượt,356827,0
những gì ăn cây bụi bằng cách sử dụng thân cây của nó,con voi,512254,0
màu của bảng là gì,màu đen,71265,2
màu của lá là gì,màu xanh lá,81397,2
một chuyến tàu tàu điện ngầm đã rời khỏi nhà ga,xe ô tô,400152,0
sự phản chiếu của con chó ở đâu,gương,437395,3
màu của áo khoác là gì,màu vàng,571768,2
màu của dấu hiệu là gì,màu vàng,263589,2
màu của dấu hiệu là gì,màu đỏ,311568,2
cái gì đang đỗ bên cạnh lề đường,xe buýt,558539,0
có bao nhiêu chiếc xe máy đậu và người đàn ông đứng cạnh một trong số họ,năm,531735,1
người đàn ông nằm ở đâu,giường,336735,3
gấu bắc cực đang đi lang thang ở đâu,bồn tắm,323583,3
búp bê được đặt ở đâu,giường,49133,3
màu của bánh là gì,màu trắng,421488,2
màu sắc của đèn giao thông là gì,màu vàng,525187,2
những gì ở trong bãi đậu xe,máy bay,567053,0
những gì đang nhìn lại những người đang chụp ảnh của mình,con bò,470145,0
nhiều bát súp nằm ở đâu,quán ăn,49096,3
cậu bé đang ngồi ở đâu,chậu,18542,3
có bao nhiêu con ngựa vằn đang đi dạo trên cánh đồng,bốn,132612,1
những gì ngồi trống rỗng và không được sử dụng trong ngày,phòng bếp,432150,0
người đang nằm ở đâu,cái ghế,247136,3
những gì được trang trí với gác chuông và một tòa tháp,tòa nhà,358342,0
màu của con chó là gì,màu nâu,240873,2
đứa trẻ nhỏ đang chơi ở đâu,giường,40757,3
hai người đang chơi trò chơi wii ở đâu,phòng,326570,3
màu của bàn chải đánh răng là gì,màu vàng,44923,2
có gì kéo vào nhà ga,tàu hỏa,530261,0
màu của đồng hồ là gì,màu đen,559754,2
có bao nhiêu người phụ nữ đang gọt táo khi đang ngồi,hai,343009,1
những gì được cập cảng ở bến cảng bên cạnh các tòa nhà cao tầng,con thuyền,420791,0
những gì nằm trên bãi cỏ,xe tải,398220,0
những gì ăn những tán lá tự nhiên ở nơi hoang dã,hươu cao cổ,414109,0
những gì dừng trên đường phố gần các tòa nhà và các dấu hiệu dừng lại,xe ô tô,433904,0
người đàn ông đang rửa tay ở đâu,phòng tắm,40901,3
cây hoặc thực vật ở đâu,sân vườn,115475,3
hai cô gái nhỏ ôm nhau ở đâu,phòng bếp,49522,3
màu sắc của chiếc khăn là gì,màu tía,117637,2
những gì tình yêu để đi xe với đầu cửa sổ xe hơi,con chó,432120,0
người đàn ông thể hiện sự lộn xộn ở đâu,tủ lạnh,40338,3
người đàn ông đang nằm ở đâu,giường,127834,3
màu của áo là gì,màu đen,306439,2
gấu bông hồng đang ngồi ở đâu,máy sấy khô,79559,3
màu của vòi nước là gì,màu vàng,113504,2
màu của hỗn hợp là gì,màu xanh lá,279503,2
cái gì đang đặt vòi của nó trên đầu một người phụ nữ,con voi,572347,0
những gì đỗ trái ngược với một số người khác,xe máy,408830,0
những gì ngồi trong nồi hình chữ nhật nhỏ,bông hoa,424984,0
màu của xe buýt là gì,màu đen,218446,2
hươu cao cổ ăn gì để lại,cây,542248,0
tủ trắng được trưng bày ở đâu,phòng bếp,109145,3
cái gì ở trên sàn lát gạch màu xám,bồn tiểu,370444,0
màu sắc của bông hoa là gì,màu đỏ,86916,2
con mèo đang cuộn tròn ở đâu,chậu,373252,3
con gấu đang ngồi ở đâu,cái ghế,479331,3
có bao nhiêu người đang ném đĩa ném cho một người khác ở phía trước của một số cái cây,một,229935,1
màu sắc của đồng phục là gì,màu xanh lá,251293,2
những gì được đặt trên một khay thức ăn khác nhau,cái thìa,356236,0
màu của khinh khí cầu là gì,màu tía,67462,2
cô gái trẻ châu á giữ được gì,chiếc ô,509590,0
con mèo xiêm nằm ở đâu,chậu,84881,3
một chiếc bánh sandwich hở mặt trên một plae bên cạnh một ly sữa,laptop,453283,0
thiết lập gì để hiển thị,phòng bếp,415194,0
người đàn ông đang dọn dẹp bồn cầu ở đâu,phòng tắm,342045,3
anh chàng đang chuẩn bị một số thứ tốt để ăn ở đâu,phòng bếp,93612,3
những gì được nhìn thấy đậu trong tuyết,xe tải,391689,0
có bao nhiêu cây gậy bóng chày trên bàn đấu giá im lặng,năm,528432,1
con mèo trắng nằm ở đâu,chậu,320563,3
"những gì được phủ ngô, cà rốt, cà chua, hành tây, ô liu, thảo mộc và dầu",món ăn,566502,0
phòng tắm nhỏ có bao nhiêu bức tường gỗ giống hệt nhau,bốn,416565,1
có bao nhiêu con voi đi một mình trên một vùng nước,ba,431628,1
có bao nhiêu người trên xe máy bị một người đàn ông chụp ảnh họ trên vỉa hè,hai,522708,1
những gì đậu trên đỉnh của một nhánh cây khô,con chim,396252,0
màu sắc của trang phục là gì,màu xanh lá,103881,2
những gì bao phủ trong rau là một nửa ăn,pizza,549224,0
màu của ghế là gì,màu đen,46927,2
những gì đang ngồi trên mặt đất được kéo bởi hai người đàn ông,con voi,566538,0
hươu cao cổ lớn và hươu cao cổ nhỏ ở đâu,chuồng,270166,3
bồn vệ sinh được nhìn thấy ở đâu,phòng,248227,3
bánh rán được chứa ở đâu,hộp,497484,3
nơi trẻ tuổi giường tầng và tủ quần áo,phòng ngủ,229990,3
những gì đỗ trên vỉa hè gạch bên cạnh một con đường,xe máy,474680,0
em bé đang ngồi ở đâu,giường,175883,3
màu của xe máy là gì,màu xanh dương,574739,2
những gì chứa đầy trái cây và kem trên bàn,máy xay,501029,0
cô gái đang mặc áo choàng ở đâu,giường,572174,3
cây kế tím ở đâu,cái nồi,196473,3
có bao nhiêu người với gói trở lại và hành lý trên nền tảng tàu,ba,308139,1
màu sắc của boong tàu là gì,màu đỏ,501867,2
những gì ngồi trong bồn tắm,con mèo,558073,0
cái gì mắc vào bánh mì thịt kéo,cái nĩa,517861,0
có bao nhiêu đĩa bánh rán và bánh ngọt trên quầy bếp,bốn,529133,1
hai người đàn ông ở đâu,con thuyền,508101,3
màu của lửa là gì,màu đỏ,137745,2
màu của bộ đồ là gì,màu đen,85624,2
con mèo nằm ở đâu,hộp,178674,3
màu của con ngựa là gì,màu nâu,33189,2
ba người mặc trang phục rằn ri của quân đội đang cắt những gì,bánh,506458,0
những gì bên ngoài vào giữa mùa đông,con cừu,381786,0
những gì được đặt bởi hàng rào bị hỏng và cây cối,vòi,524502,0
màu của gấu là gì,màu đen,439940,2
màu của xe là gì,màu đỏ,284510,2
những gì đậu trên tay cầm của một chiếc xe đạp,con chim,469480,0
con mèo nằm ở đâu,chậu,543264,3
những người đang cưỡi xuống một bãi biển bên cạnh nước là gì?,con ngựa,456015,0
một số gói hành lý ở đâu,xe ô tô,228105,3
màu của con mèo là gì,màu đen,542946,2
nơi người đàn ông đang đi ra ngoài và chào ai đó là gì,tòa nhà,572900,0
những gì đang kéo giỏ hàng với một người trong đó,con ngựa,497145,0
"người phụ nữ trông có vẻ không quan hệ như vậy, túi bông cải xanh lớn, cô đang giữ",cửa hàng,202168,3
cái gì nằm trong thùng chứa với bút và bút đánh dấu,cây kéo,340930,0
màu sắc của bông hoa là gì,màu tía,16890,2
những gì nằm xuống bên cạnh máy tính xách tay,con mèo,493295,0
con mèo đáng yêu đang ngóc đầu lên ở đâu,hành lý,388312,3
có bao nhiêu con chim trên dây điện một mình,sáu,255176,1
những gì chứa bánh rán và một tách cà phê,cái mâm,571847,0
có bao nhiêu chiếc xe tải đang đậu trong một nhà để xe,ba,545749,1
màu của xe máy là gì,màu vàng,399102,2
pizza đang được nấu ở đâu,chảo,497500,3
những gì đang giữ một con gà và các loại rau,cái mâm,345137,0
có bao nhiêu nam vận động viên trượt tuyết đang đứng trên dốc trượt tuyết,ba,394058,1
màu sắc của xe máy là gì,màu xanh lá,365138,2
đứa trẻ đang ăn bánh rán ở bàn là gì,sô cô la,434930,0
những gì đang đậu trên đường ray xe lửa,xe lửa,482585,0
chuyện gì đang xảy ra trên đường,tàu hỏa,372070,0
mọi người đang nằm ở đâu,đường bộ,475120,3
màu của chiếc ô là gì,màu đỏ,22409,2
những gì được đặt bên cạnh cây trên cỏ,băng ghế,491508,0
người đó đã trượt tuyết trên tuyết bao phủ gì,ngân hàng,473121,0
hai thứ đang ngủ trên bàn,con mèo,499365,0
màu của dấu là gì,màu đỏ,362278,2
những gì trên hồ khi một cơn bão đến gần,con thuyền,513507,0
những gì chứa cả máy tính xách tay và máy tính pc và màn hình,cái bàn,531697,0
màu của dĩa nhựa là gì,màu vàng,337269,2
có bao nhiêu con hươu cao cổ đang đứng thẳng trong khi con kia bị uốn éo ở một vị trí kỳ lạ,một,233553,1
màu của vật đang ngủ là gì,màu cam,240289,2
"những gì đang đứng một mình trong một đồng bằng rộng, rộng",hươu cao cổ,434735,0
hai hàng xe máy xếp ở đâu,đường phố,216840,3
người đàn ông trong một chiếc áo khoác giữ những gì,chuối,414736,0
có bao nhiêu chiếc ô tô đậu trên bãi cỏ khi một đoàn tàu đi qua,hai,73215,1
có bao nhiêu người đang đứng bên chiếc bánh hình lá cờ mỹ,bốn,133650,1
màu của điểm dừng là gì,màu đỏ,492705,2
màu của sự cân bằng là gì,màu xám,308812,2
những gì đang làm sạch trên sàn trong một phòng tắm lát gạch,trang thiết bị,453093,0
màu của nửa là gì,màu cam,464715,2
những gì có nhiều loại pizza khác nhau,quán ăn,523677,0
có một cây cổ thụ ở đâu,vườn bách thú,428837,3
giường với một cục văn phòng và một tấm gương được hiển thị,phòng ngủ,210612,3
màu của xe đạp là gì,màu cam,187509,2
có bao nhiêu con ngựa đen đang đứng với một giỏ hàng gắn liền với chúng,hai,577488,1
những gì ở phòng tắm gạch và được một cặp vợ chồng đang treo lên,khăn,570138,0
màu của máy bay là gì,màu vàng,198524,2
bao nhiêu người trượt tuyết đang tạo dáng chụp ảnh trước thang máy,bốn,202981,1
xe tải với một cây đàn guitar ở đâu,đường đi bộ,362067,3
những chiếc bánh rán được chứa ở đâu,hộp,238562,3
có bao nhiêu người đang chơi trò chơi điện tử bằng điều khiển từ xa,hai,454751,1
những gì đứng đầu với máy tính xách tay với hai màn hình,cái bàn,549674,0
bếp và tủ lạnh ở đâu,phòng bếp,248132,3
những gì đỗ sau xe van trên cỏ,xe đạp,436559,0
có bao nhiêu máy bay trên một dải hạ cánh bên cạnh cánh đồng xanh và hàng rào có dây,hai,426840,1
người đàn ông đang nằm ở đâu,giường,561062,3
"người đội mũ bảo hiểm xe đạp, giơ bao nhiêu quả chuối",hai,482439,1
có bao nhiêu con ngựa vằn ở gần nhau trên cánh đồng gần cỏ,bốn,182849,1
nải chuối nằm ở đâu,cái rổ,127535,3
người sử dụng cái gì,máy ảnh,459921,0
màu của xe máy là gì,màu đỏ,130553,2
những gì được ngồi trên cành cây,con chim,389957,0
có bao nhiêu người đàn ông cưỡi ngựa gần hàng rào gỗ,hai,529344,1
hai câu chuyện bên cạnh một tòa nhà có khung màu nâu,tòa nhà,368884,0
những người lớn tuổi ngồi ở đâu,chiếc ô,174399,3
những người mặc áo khoác đang cưỡi trên bãi biển là gì,con ngựa,456015,0
màu của bếp là gì,màu đen,25765,2
có bao nhiêu người đang ngồi trên những chiếc ghế nhựa màu trắng có đầu rồng lớn phía sau họ,bốn,417469,1
cái gì đang đứng ở rìa của một số cái cây,ngựa vằn,359751,0
màu của chiếc hộp là gì,màu xám,96157,2
những gì đang đứng với nhau trong một hàng bởi một số cây,ngựa vằn,501243,0
cái gì đang ngồi cạnh hai quả cam,chuối,497661,0
những gì chống lại bức tường màu đỏ,cái bàn,539439,0
những gì đang ngồi trên một dải dây thép gai,con chim,395378,0
có một người phụ nữ đang cầm cái gì,donut,341603,0
màu của bầu trời là gì,màu xanh dương,321577,2
những gì đang đi bộ nhìn xuống có thể ăn cỏ,ngựa rằn,539129,0
một số cô gái và một người đang làm món ăn ở đâu,phòng bếp,2083,3
những gì cắt một nửa trên đỉnh của một miếng giấy thiếc,sandwich,494747,0
nhà vệ sinh có hình dạng như một hình vuông ở đâu,phòng tắm,448771,3
những gì bên cạnh nhau trước cửa sổ,giường,527994,0
cậu bé mặc cái gì vung gậy,đồng phục,457616,0
có bao nhiêu người trẻ tuổi đang chuẩn bị ăn một bữa ăn,năm,441462,1
có bao nhiêu con chó với chiếc khăn tay ăn thức ăn trên đĩa,hai,321385,1
những gì bên cạnh bàn có các mặt hàng điện tử trên đó,cái ghế,513688,0
ai đó đang giữ một chiếc bánh sandwich,cái mâm,52096,3
cái gì và gurney bên cạnh xe máy,xe cộ,454129,0
hai người đứng ở đâu trong tuyết,trang thiết bị,221794,3
thuyền đậu ở đâu,bến du thuyền,345944,3
có bao nhiêu con hươu cao cổ trong tự nhiên trên một cánh đồng cỏ,hai,163104,1
biển báo cho người lái xe biết họ chỉ có thể đi bao nhiêu đường,một,498563,1
có bao nhiêu người trên ván trượt trên một con dốc lạnh lẽo,sáu,488243,1
màu của con ngựa là gì,màu nâu,191568,2
màu của kính là gì,màu xanh dương,58245,2
những gì cuộn tròn trên chăn mặc một chiếc cà vạt nhỏ,con mèo,406395,0
con gì đang bị các động vật khác bao vây,hươu cao cổ,581100,0
con mèo nhìn thấy sự phản chiếu của nó ở đâu,gương,195886,3
người phụ nữ đang cắn pizza ở đâu,quán ăn,570522,3
những gì đang được cạo bằng kéo,con cừu,500477,0
con chim đang đứng ở đâu,tòa nhà,191262,3
có bao nhiêu điều khiển từ xa nằm trên các quả bóng màu,năm,334109,1
có bao nhiêu con hươu cao cổ đang đi quanh cây bút của chúng trong bụi bẩn,hai,195600,1
những gì cao chót vót trong đám mây xanh bao phủ bầu trời,tòa tháp,509551,0
cái gì đang ngồi trên vỉa hè,vòi,471350,0
cái gì đậu gần một chiếc ô tô,xe tải,377946,0
những gì nghỉ ngơi trong cốc với các điểm đánh dấu và các công cụ khác,cây kéo,410924,0
có bao nhiêu con dê núi đang đứng giữa những tảng đá trên núi,ba,131093,1
người phụ nữ và một cô bé cầm những gì,chiếc ô,428985,0
xe buýt đang ở đâu,đường phố,476060,3
sô cô la lấp đầy những gì với những rắc đường ở bên ngoài,donut,416787,0
màu của lá là gì,màu xanh lá,333216,2
cô gái đang chơi một trò chơi điện tử ở đâu,phòng,350701,3
màu của bóng là gì,màu đen,413539,2
cái gì đang đỗ trên cỏ xanh,xe máy,455716,0
một số chanh và cam và nho ở đâu trong đĩa,lọ cắm hoa,572301,3
những gì được xếp hàng ở bến cảng vào ban đêm,con thuyền,361085,0
màu của con mèo là gì,màu cam,286141,2
một quý ông lớn tuổi cũ kiểm tra những gì,chai,502671,0
có bao nhiêu con voi đứng trong một vòng vây sau hàng rào,hai,488880,1
màu của vùng đât là gì,màu xanh lá,229352,2
người ngồi ở đâu,giường,278963,3
nhóm người đang đứng trong phòng là gì và một trong số họ đang xem,những bức ảnh,366104,0
có bao nhiêu xe buýt đậu trong hàng trong một bãi đậu xe,sáu,576122,1
những gì đứng trước bầu trời xanh,tòa nhà,553588,0
người đàn ông đang chuẩn bị pizza ở đâu,phòng bếp,521218,3
màu của chiếc bình là gì,màu xanh lá,264969,2
những gì trên bàn,pizza,485288,0
có bao nhiêu con cú nhỏ tụ tập với nhau trong một bao vây,hai,88621,1
cái gì được tổ chức trên cột trên vỉa hè cạnh một tòa nhà,đồng hồ,460149,0
salad đã được phục vụ ở đâu,bát,418722,3
những gì nằm trong nhóm cây,xe đạp,453138,0
những gì đang giữ một thức uống lành mạnh nằm bên cạnh một quả chuối và một bát granola,hộp,454731,0
màu của bầu trời là gì,màu xanh dương,60054,2
những gì đang tận hưởng nước ngoài khơi,con vịt,507550,0
người đang giữ gì bên ngoài,điện thoại,493424,0
cái gì đậu ở khu vực nông thôn,xe tải,363887,0
cái gì đang lái xe qua cánh đồng với một con sếu trắng,xe tải,379376,0
màu của ria mép là gì,màu trắng,429059,2
hai tàu màu vàng ở đâu,tòa nhà,348639,3
con mèo đang ngủ ở đâu,cái ghế,183957,3
những gì phủ với các bông hoa phô mai và bông cải xanh,pizza,480407,0
màu sắc của thung lũng là gì,màu xanh lá,209851,2
có bao nhiêu người đàn ông đứng trên ván trượt trên con đường mòn phía trước núi,hai,15496,1
những gì đang ở trong túi hành lý,máy vi tính,578553,0
màu của mỏ là gì,màu cam,83566,2
có bao nhiêu hình ảnh đồ ăn khác nhau,sáu,58796,1
đoàn tàu chạy qua tàu khác ở đâu,trạm,537861,3
những gì đồng hồ theo chủ đề ngồi bên trong hộp màu xanh lá cây,con chim,386193,0
những gì bên cạnh con hươu cao cổ,hươu cao cổ,558741,0
những gì chơi với nhau trên những tảng đá,gấu,532985,0
người đàn ông mặc gì,cà vạt,565670,0
màu của bảng là gì,màu nâu,381642,2
ván trượt nằm ở đâu,đường phố,493613,3
những gì kéo dài trên bàn máy tính,con mèo,518324,0
con mèo trắng đứng ở đâu,cây,310928,3
cái gì nằm trong chảo phía trên cho rau cắt nhỏ,gà tây,345137,0
màu sắc của đồng hồ là gì,màu tía,101675,2
người đàn ông mặc gì và đứng cạnh tàu,bộ đồ,461802,0
