question,answer,img_id,type
người phụ nữ đặt pizza ở đâu,lò vi sóng,457599,3
cái gì nằm trên lưng của một con ngựa vằn khác,ngựa rằn,443591,0
màu của mái nhà là gì,màu trắng,476127,2
gấu bông trắng lớn đang ở đâu,cái ghế,96984,3
những gì bị bỏ rơi trong cánh đồng này,tủ đá,427386,0
"bốn quả cam, cà rốt; bưởi, cây trứng, măng tây và hành tây trên bàn nằm ở đâu",cái túi,449467,3
tv và ghế sofa đang ở đâu,phòng,86226,3
cái đĩa nhựa tách rời đang giữ cái gì,bữa trưa,368581,0
những gì ngồi vào container đi,con chó,495388,0
hai con chó đứng ở đâu bên ngoài,hồ bơi,238915,3
người đang tắm cho một con chó ở đâu,bồn tắm,467252,3
con chó nhìn ra cửa sổ ở đâu,xe ô tô,119805,3
màu của con chó là gì,màu nâu,196346,2
cái gì lội qua vùng nước,con voi,510154,0
hình ảnh của cặp vợ chồng ở đâu,cửa sổ,239347,3
thiết bị nào đi xe,xe máy,466939,0
những gì đỗ trên lối đi gần green grass,xe máy,395324,0
có bao nhiêu người trên bãi biển đang cưỡi ngựa,sáu,432410,1
điều gì thu nhận ánh sáng vào phòng khách,cửa sổ,364470,0
có bao nhiêu phụ nữ mặc váy hoa đang ngồi vào bàn,bốn,430257,1
những người đứng cạnh một vành đai nhận hành lý ở đâu,sân bay,256877,3
cái gì đang ngồi trên thớt với một cái máy gọt vỏ,quả táo,360706,0
màu của lửa là gì,màu đen,398177,2
màu của xe là gì,màu vàng,11812,2
những gì giữ một bình hoa dại,mặt,547102,0
những gì kéo xe kéo du hành xuống giữa một con đường,con ngựa,524431,0
ba thanh niên cầm cái ly gì khi đứng ở quán bar,rượu,515716,0
màu sắc của bông hoa là gì,màu vàng,402957,2
màu của động vật là gì,màu đen,105134,2
cái gì đang ngồi trong máy tính xách tay,con mèo,425027,0
xe buýt ở đâu,đường phố,268711,3
cái gì đằng sau tảng đá và hoa,vòi,463303,0
màu của xe máy là gì,màu cam,242472,2
đỗ những gì đang đỗ dưới tán,xe tải,545749,0
có bao nhiêu người trên xe máy bị một người đàn ông chụp ảnh họ trên vỉa hè,hai,522708,1
màu của cây là gì,màu cam,531093,2
những gì đang chờ đợi trong khi chủ sở hữu của anh ta cắt một ít thịt,con chó,419974,0
con mèo đang nằm ở đâu,chậu,543264,3
màu của khuôn mặt là gì,màu cam,38896,2
màu của cổng là gì,màu vàng,175270,2
màu của cà vạt là gì,màu đỏ,102281,2
có bao nhiêu máy bay đang bay trong hình thành trên bầu trời,bốn,506371,1
màu của chiếc đĩa là gì,màu trắng,74403,2
đứa trẻ trẻ đang chơi wii ở đâu,phòng,25423,3
những gì đứng cạnh cực với một số tảng đá trên mặt đất,hươu cao cổ,454854,0
đang ăn gì khi ngồi trên tảng đá,con khỉ,360318,0
màu của túi là gì,màu nâu,101245,2
gặm cỏ trong một cánh đồng cỏ,con ngựa,449132,0
người đàn ông nhìn vào đâu cạo râu mặt,phòng tắm,191691,3
những gì đang đi với những động vật khác nhau trên sa mạc,ngựa vằn,459898,0
màu của túi là gì,màu xanh dương,408116,2
"salad làm từ cà rốt, đậu xanh và zucchini chứa ở đâu",thùng chứa,473866,3
màu của áo hoodie là gì,màu tía,268739,2
màu của con bò là gì,màu nâu,557101,2
những gì nhìn xung quanh trong sân,con chó,565341,0
có bao nhiêu con hươu cao cổ đang đứng trên cánh đồng 2 đang quay mặt về phía trước,bốn,141414,1
con chó pug đen đang ở đâu,cái ghế,226308,3
những gì phủ bóng trên bầu trời trong xanh,diều,509270,0
những gì đi bộ ở rìa của nước,con bò,526044,0
những gì được hiển thị trong bức ảnh này,phòng tắm,485916,0
những gì đang đứng xung quanh không làm gì cả,hươu cao cổ,474471,0
những gì ở phía trước của một bức màn,tủ đá,407520,0
người đàn ông đang chống tay ở đâu khi cầm ván trượt,đường bộ,534687,3
"những gì được trang bị với quầy bếp, tủ lạnh, lò nướng và kệ",phòng bếp,460208,0
nhà vệ sinh đang đặt ở đâu,vòi hoa sen,549209,3
nhà vệ sinh trắng đang đặt ở đâu,phòng tắm,357865,3
có bao nhiêu phụ nữ chơi trong một trận đấu quần vợt chuyên nghiệp,hai,12120,1
người thanh niên ném cái gì vào giỏ,dĩa nhựa,509695,0
người đàn ông đang khuấy động một cái nồi ở đâu,phòng bếp,143789,3
những gì có xếp chồng lên nhau trên kệ,vali,534664,0
năm người cưỡi những gì trên đường,xe máy,534827,0
người phụ nữ ngồi ở đâu với hai chân nâng lên,băng ghế,205007,3
cậu bé đánh đến một người chơi tennis khác cái gì,quả bóng,529539,0
những bức tường được xếp ở đâu,phòng,380248,3
cô gái trẻ đang xem điện thoại của cô ấy ở đâu,cái ghế,175541,3
có bao nhiêu người cầm vợt đứng bên lưới quần vợt,năm,17927,1
những gì chia sẻ cành mà họ đang ăn,hươu cao cổ,420472,0
những gì tiếp theo bên cạnh một chiếc macbook pro nguyên sơ,laptop,528049,0
có bao nhiêu người lướt sóng đang lướt trong sóng biển,hai,509415,1
những gì đang đến gần ga nơi một người đàn ông đang đứng,tàu hỏa,395046,0
nơi trưng bày thú nhồi bông,cửa hàng,375202,3
một số nhân viên đứng xung quanh đâu,quán ăn,32074,3
một số động vật đứng ở đâu,chuồng,388020,3
một số chàng trai trẻ đang vui vẻ ở đâu,đường phố,213034,3
màu của mũ bảo hiểm là gì,màu xanh dương,396137,2
cái gì đậu trên cỏ,xe tải,360064,0
người phụ nữ đang nhìn ở đâu khi cô ấy đánh răng,gương,297929,3
những gì ăn cỏ xanh tươi tốt bởi một hàng rào dây,con ngựa,516827,0
cái gì đang nhìn qua một hàng rào kim loại lớn,hươu cao cổ,375765,0
màu của bánh là gì,màu trắng,531362,2
con chó đang thi trên một tấm thảm là gì,đồ chơi,537636,0
người đàn ông hói đầu đưa cho đâu,sân bay,268876,3
cô gái nằm ở đâu,vali,529283,3
người đàn ông đang giữ một điện thoại thông minh là gì,trường hợp,431746,0
những gì đang đỗ bên cạnh chiếc xe máy màu xanh,xe máy,495613,0
một con voi châu phi nuôi từ bụi cây,thân cây,399893,0
những gì nâng cao thân của họ với nhau,con voi,340305,0
pizza đưa vào đâu trên giá kim loại,lò vi sóng,517690,3
ăn những gì rải rác trên mặt đất để tiêu thụ,bãi cỏ,474347,0
những gì cắt thành các mảnh khác nhau nằm trên một khay tại một bàn,bánh,564418,0
thư viện có bàn và đóng cái gì với một người đang học,laptop,509811,0
những gì chứa đầy nhiều hoa màu khác nhau,lọ cắm hoa,492911,0
có bao nhiêu con hươu cao cổ ở cùng nhau trong chuồng của chúng và một số cái cây,ba,126638,1
có bao nhiêu đường ký hiệu gỉ sét qua dấu hiệu với mũi tên đã gắn vào nó,một,570045,1
người đàn ông và một đứa bé đang ở đâu,phòng bếp,436649,3
những gì dường như đang ôm nhau dưới những cái cây,ngựa vằn,487534,0
"cái gì đang ngồi trên bàn, dường như có tất cả mọi thứ trên đó",pizza,366677,0
phía trước có gì trong giỏ với các loại rau khác phía sau,cà rốt,347724,0
có bao nhiêu cầu thủ bóng chày trên sân được cắt tỉa cẩn thận,ba,290875,1
một số tay đua xe đạp mỉm cười tiếp cận những gì,chim bồ câu,515289,0
những bó hoa khác nhau cắm ở đâu,lọ cắm hoa,474439,3
làm gì có bồn rửa và tủ,phòng bếp,356400,0
một con mèo màu cam và trắng đang ngồi ở đâu,cái ghế,331530,3
những gì đỗ bên cạnh vỉa hè,xe buýt,466346,0
những gì ở khu vực dành cho người đi bộ thành phố xếp hàng trong mùa thu,cây,558992,0
có bao nhiêu đứa trẻ nhỏ đang đánh răng trong bồn tắm,hai,300538,1
người đàn ông đang mang cái gì qua cây,ván lướt sóng,360350,0
những gì đi bên cạnh một bức tường đá khổng lồ,gấu,547645,0
màu của chiếc bình là gì,màu đen,136993,2
những gì được bao phủ trong phô mai trên đỉnh của một tấm,con chó,451598,0
những gì cúi xuống đang ăn cỏ đứng cạnh một hàng rào,hươu cao cổ,528261,0
người cưỡi ván lướt sóng với cái gì,mái chèo,531018,0
có bao nhiêu chiếc bánh rán phủ băng được bày trên khay kim loại,bốn,419379,1
điều gì đang hiển thị hai đồng hồ,tòa nhà,547440,0
những gì chủ yếu được trang trí bằng màu trắng,phòng tắm,380854,0
màu của bảng là gì,màu đen,348825,2
người lính mất điện thoại ở đâu,văn phòng,323789,3
nơi triển lãm thương mại khách và công nhân,gian hàng,448076,3
gấu nhồi bông lớn đang ngồi ở đâu,cái ghế,307020,3
những gì đang chiếm cảng cát bên cạnh nước,con bò,427865,0
những gì đang ngồi trên cỏ gần một số bông hoa màu vàng,con mèo,389969,0
bạn của con chó này là gì,gấu,537636,0
hai chiếc máy bay có hình gì bay qua bầu trời xanh,diều,421307,0
có bao nhiêu bộ điều khiển trò chơi nintendo wii đang ngồi trên bàn,hai,523505,1
màu của bồn là gì,màu xanh dương,51583,2
cô gái đang giữ bàn chải đánh răng ở đâu,phòng tắm,414010,3
ăn cỏ trong một cánh đồng là gì,ngựa rằn,551602,0
những gì bên cạnh điện thoại và phích,máy vi tính,450391,0
một bộ giường mới nằm ở đâu,phòng ngủ,309521,3
hai đứa trẻ đang ngồi trên nhà vệ sinh ở đâu,phòng tắm,66514,3
đâu là bó hotdogs nơi nấu ăn,cái nồi,46298,3
hai người và một số thức ăn được chứa đầy những gì,đĩa,528821,0
cái gì được gắn vào cái cực,xe đạp,370208,0
hai người phụ nữ cưỡi trên lưng của ai đó những gì,xe máy,392392,0
có bao nhiêu con gấu bông nâu được xếp trên kệ,bốn,357113,1
một số người cưỡi những gì một đường phố và cây cối,xe máy,508985,0
có bao nhiêu con bò ở bãi biển đang nhìn sang trái,ba,569520,1
màu của lá là gì,màu xanh lá,200796,2
điều gì đang đối mặt với nhau trên đường ray,xe lửa,478225,0
những gì được trưng bày trong hộp trên kệ,đồng hồ,338327,0
những gì cao chót vót trên thành phố london,đồng hồ,415413,0
người phụ nữ đang cầm vợt ở đâu và tìm kiếm,gương,81003,3
trái cây chồng chất ở đâu,cửa hàng,498919,3
màu sắc của dây nịch là gì,màu tía,305690,2
những gì tình yêu để đi xe với đầu cửa sổ xe hơi,con chó,432120,0
có bao nhiêu con voi đang gặm cỏ trên đồng cỏ xanh tươi dưới những đám mây đen,ba,84495,1
màu của xe buýt là gì,màu vàng,305549,2
cái gì đang bị cắt bởi một con dao,quả táo,579201,0
những gì đang đóng ở bàn bên ngoài khách sạn,chiếc ô,500211,0
hươu cao cổ đang ngồi xuống đâu,chuồng,439288,3
màu của dĩa nhựa là gì,màu cam,309168,2
đầu bếp mở lò nướng ở đâu,phòng bếp,189278,3
hai chàng trai trẻ đang ăn pizza ở đâu,phòng bếp,175480,3
màu của chiếc cặp là gì,màu đen,531076,2
màu của lá là gì,màu xanh lá,31540,2
màu của tường là gì,màu cam,188511,2
tủ đông tủ lạnh trắng đang ở đâu,phòng bếp,57503,3
con mèo đen đang ngồi ở đâu,gầu múc,542946,3
người đàn ông quay lại dùng cây vợt của mình làm gì,quả bóng,373356,0
màu sắc của chiếc váy là gì,màu tía,243657,2
người đàn ông đang nằm ở đâu,giường,421077,3
các công cụ nằm ở đâu,phòng tắm,59515,3
chuối nấu sốt gì,chảo,380951,0
một số trái cây đang phát triển ở đâu,sân vườn,257029,3
đàn cừu được nhốt ở đâu,chuồng,215480,3
cái gì ngồi ở phía trước của một lớp học trống,màn,373170,0
người đàn ông đã thoát khỏi đâu,con thuyền,436717,3
hai bông hoa màu tím ở đâu,lọ cắm hoa,374677,3
con mèo đen đang mặc gì và nhìn vào camera là gì,cà vạt,534942,0
hai màn hình máy tính ở đâu,văn phòng,205460,3
những gì được neo đậu tại bến tàu bằng dây thừng,con thuyền,399538,0
những gì có đồng hồ treo ở trên cùng,tòa nhà,574110,0
người đàn ông cạo một con cừu trắng ở đâu?,chuồng,182275,3
người đàn ông tự sướng ở đâu,gương,97682,3
những gì đang đứng trong bóng râm,con cừu,427643,0
có bao nhiêu con cừu đang đứng cạnh người đàn ông cầm cây gậy,năm,296573,1
kéo và bút đặt trên một hình tam giác là gì,mặt,430762,0
chàng trai và cô gái giúp một người phụ nữ nướng bánh ở đâu,phòng bếp,233642,3
người phụ nữ đang mang cái gì kế một vòi chữa cháy rất cao,túi,378831,0
màu của ngôi nhà là gì,màu trắng,267708,2
con chó đang nhìn ở đâu,cửa,400134,3
có bao nhiêu con ngựa ở giữa đồng cỏ,năm,447830,1
những gì đang đứng dưới cây xanh,con bò,512648,0
học sinh đang ở đâu,cái ghế,151864,3
hai người đàn ông cố định tóc ở đâu,gương,406187,3
màu của cưỡi là gì,màu xanh dương,69081,2
những gì đỗ bên ngoài cơ sở nhà hàng địa phương,xe đạp,435444,0
màu của con chim là gì,màu nâu,172751,2
anh ấy đang ôm em bé ở đâu,cái ghế,356248,3
màu sắc của người đàn ông là gì,màu đen,79090,2
màu của chiếc thẻ là gì,màu vàng,139618,2
những con thú bị nhốt ở đâu,lồng,259029,3
người đang giữ gì bên ngoài,điện thoại,493424,0
màu của con cừu là gì,màu nâu,502593,2
màu của chất thải là gì,màu xanh dương,338059,2
hai con chó trắng ngồi ở đâu,xe ô tô,319062,3
trên bàn có bao nhiêu chiếc bánh pizza phủ đầy rau,hai,188850,1
màu của khu vực là gì,màu xanh lá,202629,2
những gì có các thiết bị trắng và tường màu be,phòng,428041,0
người dân đi xe đạp và ván trượt ở đâu,đường,243825,3
khoai tây và hẹ hầm ở đâu,món ăn,310546,3
con ngựa kéo bốn người ở đâu,đường,517603,3
một số động vật tấn công ở giữa hư không,xe ô tô,529004,0
những người đàn ông mặc áo đỏ đang cưỡi gì,con thuyền,519027,0
có bao nhiêu đĩa bánh ngọt tráng miệng trên quầy bếp,bốn,223474,1
những gì đang cho ăn trên mặt đất với nhau,ngựa vằn,529348,0
cái gì đang đặt trên đĩa,donut,357620,0
màu của băng ghế là gì,màu vàng,240653,2
màu của lửa là gì,màu vàng,572804,2
người phụ nữ đang thưởng thức một món salad ở đâu,quán ăn,182997,3
vài con cừu đang ở đâu,chuồng,50304,3
"đâu là nhiều đầu bếp trong những chiếc mũ cao, mũ trắng chuẩn bị bữa ăn",phòng bếp,547475,3
có bao nhiêu bình chứa hoa trắng và tím,hai,557987,1
màu của khu vực là gì,màu xanh lá,314647,2
màu của cái bát là gì,màu trắng,74002,2
người đàn ông cho bao nhiêu con hươu cao cổ trong chuồng ở vườn thú,hai,183756,1
màu sắc của đĩa là gì,màu đỏ,331551,2
những gì sắp xếp độc đáo din một hộp,donut,458313,0
màu của con con là gì,màu nâu,504280,2
màu của chiếc tàu là gì,màu vàng,443377,2
người trẻ đang giữ những gì,gậy,386764,0
những gì được lưu trữ trên kệ dưới đồng hồ thời gian,nón,417159,0
cái gì cọ đầu vào nhau sau hàng rào,ngựa vằn,341950,0
có bao nhiêu con cừu trên đồng cỏ vào một ngày nắng,mười,353302,1
cừu len ở đâu,chuồng,374023,3
"xe van, xe máy và xe đạp trẻ em đậu ở đâu",đường phố,270211,3
màu của ngôi nhà là gì,màu đỏ,187869,2
những gì được đặt trên sàn nhà,chén đĩa,368679,0
màu của cà vạt là gì,màu xanh lá,445774,2
màu sắc của kéo là gì,màu xanh dương,309695,2
màu của chiếc ô là gì,màu tía,229544,2
những gì đang lấy đồ uống từ vũng nước,con chim,490125,0
người đang đi đâu trên ván trượt của mình,đường phố,135270,3
màu sắc của đồ lót là gì,màu đen,136540,2
em bé đang ăn một miếng thức ăn ở đâu,phòng bếp,223369,3
bao nhiêu người trượt tuyết di chuyển chậm rãi và cẩn thận dọc theo mặt đất phủ đầy tuyết,ba,276584,1
màu sắc của bông hoa là gì,màu tía,349621,2
bánh pizza chưa nấu chín với xúc xích nằm ở đâu,chảo,497500,3
có gì đỗ bên cạnh một chiếc xe buýt cũ,xe ô tô,543043,0
điều gì đã lái qua con tàu đang đi ra khỏi đường hầm,xe ô tô,372794,0
những gì đang hoạt động trên bãi biển,con chó,572050,0
người đàn ông mặc áo khoác tối màu đang sử dụng cái gì,điện thoại,436791,0
màu của dấu hiệu là gì,màu vàng,312344,2
có bao nhiêu người chơi đang đứng trên sân tennis cầm vợt và cười,bốn,69934,1
cái gì đang ngồi dưới bầu trời đầy sương mù,tòa tháp,430760,0
người đang nằm ở đâu,giường,36022,3
có bao nhiêu người đang cúi xuống nhìn trong một cái tủ lạnh nhỏ,hai,334631,1
màu của gấu là gì,màu nâu,544279,2
màu của hồ là gì,màu xanh dương,350361,2
màu của mèo con là gì,màu xám,88608,2
những gì đang nhìn nhau trong một cửa sổ,con mèo,572184,0
những gì được thể hiện với sự phá sản của một người đàn ông,điêu khắc,538064,0
màu của xe máy là gì,màu xanh dương,211449,2
màn hình nào với tầm nhìn của những người ở bàn bên dưới,máy vi tính,519471,0
màu sắc của người đàn ông là gì,màu xanh dương,69081,2
những con chim đứng ở đâu,lồng,455405,3
có bao nhiêu người lướt ván đứng trên ván của họ trong một làn sóng,ba,45809,1
có bao nhiêu con ngựa vằn đứng xung quanh ngoài tự nhiên,bốn,182240,1
những gì đứng yên trong môi trường sống của chúng,ngựa vằn,509588,0
cái gì đang với lên để lấy một sợi lông trên một sợi dây,con mèo,372227,0
người đàn ông và một người phụ nữ dùng thử một trò chơi video ở đâu,cửa hàng,84489,3
màu của cái bàn là gì,màu trắng,142958,2
gấu teddy trắng đang ở đâu,cái ghế,87141,3
con người đang cưỡi lên những gì,con voi,572347,0
màu của quần short là gì,màu trắng,92366,2
những gì có vẻ rất thấp đến sàn,nhà vệ sinh,404608,0
người đàn ông ngồi trên một chiếc ghế dài và ăn những gì,sandwich,498765,0
ngồi cạnh nhau trong phòng khách sạn là gì,giường,397512,0
con chó lớn nằm ở đâu,phòng,222317,3
những gì đang đi bên cạnh bức tường đá,hươu cao cổ,442614,0
những gì đang bay trên bầu trời trên một hồ nước,con chim,544811,0
màu của chuối là gì,màu xanh lá,74901,2
điều gì đang nhìn vào một cái gì đó trong khi đứng gần một hàng rào,hươu cao cổ,384848,0
những gì cuộn tròn thân cây của mình trong một khu vực có rào chắn,con voi,392905,0
"làm gì, những con cừu này ăn",hay,341128,0
nơi có lửa và hai cái ghế,phòng,424161,3
có bao nhiêu cái bánh trên cái bàn màu đỏ,hai,351719,1
hai người đàn ông đang chơi trò chơi điện tử ở đâu,phòng,544850,3
nhóm các chàng trai trượt băng ở đâu,đường phố,493597,3
có bao nhiêu đầu bếp đang chuẩn bị bữa tối cho nhà hàng,hai,495489,1
bộ hành lý nằm ở đâu,bánh xe,226224,3
hai con ngựa vằn đang đứng ở đâu,chuồng,115191,3
hai người phụ nữ và một người đàn ông đang cầm gì khi uống rượu,kính đeo,515716,0
màu của chiếc đĩa là gì,màu xanh dương,306288,2
có bao nhiêu con cừu thò ra khỏi tường và ăn cỏ khô trên mặt đất,năm,213739,1
những gì tàu kéo than đứng trên một mặt trước một kho,tàu,546524,0
có bao nhiêu con bò ăn cỏ trên cánh đồng cỏ,hai,379279,1
một người phụ nữ lớn tuổi đang rán một số bánh rán ở đâu,chảo,487349,3
ba người trượt tuyết lấy những gì nâng núi lên,bầu trời,434618,0
hiển thị gì hiển thị 0 phút để đi,lò vi sóng,422783,0
màu của thảo mộc là gì,màu xanh lá,556360,2
một số bánh mì nằm ở đâu,lò vi sóng,129006,3
những gì đang đi trên đường ray,tàu hỏa,484225,0
có bao nhiêu lát bánh pizza phô mai với một cái nĩa và một con dao,tám,357229,1
những gì nằm ở phía trước của một giá sách,laptop,435359,0
màu của gấu là gì,màu vàng,551166,2
"có bao nhiêu con ngựa nâu, to lớn có lông dài",hai,503144,1
màu của lá là gì,màu xanh lá,332723,2
con mèo đang nhìn ở đâu,gương,45603,3
điều gì cho thấy bộ đồ giường đơn giản và nhỏ với trang trí kết cấu tuyệt vời,phòng ngủ,551154,0
những gì đang đỗ gọn gàng trong hàng,máy bay,500718,0
một cái bàn gỗ ở đâu,phòng,90888,3
con mèo đen trắng nằm ở đâu,cái ghế,240691,3
con hươu cao cổ được đặt ở đâu,vali,502459,3
con vật màu đỏ gặm cỏ trên đồng là gì,con bò,572069,0
người phụ nữ đang sấy tóc cho một đứa trẻ ở đâu,phòng tắm,362166,3
hai con voi đứng ở đâu,chuồng,463751,3
màu của cốc là gì,màu xanh dương,265036,2
có bao nhiêu con cừu lông cừu đang gặm cỏ trên đồng cỏ có hàng rào phủ đầy tuyết trong thung lũng,năm,203063,1
màu của vali là gì,màu xanh dương,491701,2
những gì bị kẹt trong giao thông trên đường chính,xe buýt,398119,0
có bao nhiêu đồng hồ treo trên hình vuông từ trần nhà,bốn,533004,1
người phụ nữ nằm ở đâu,giường,282943,3
con mèo trắng và đen đang ở đâu,cái túi,381944,3
màu của lửa là gì,màu đỏ,501002,2
màu của vòi nước là gì,màu vàng,439278,2
những gì đang kéo một chiếc xe lửa màu đỏ,động cơ,429558,0
có bao nhiêu người ở một nơi đầy tuyết gần hàng rào gỗ,hai,489145,1
màu của bầu trời là gì,màu xanh dương,448503,2
con gấu đang ngồi ở đâu,cái ghế,479331,3
cặp trẻ em cạnh một cặp bồn rửa mặt ở đâu,gương,155519,3
"chuối, táo và cam ở đâu",bát,331505,3
những gì đang được theo sau bởi hai con voi nhỏ,con voi,405972,0
những gì nằm tại bến cảng dọc theo những chiếc thuyền khác,con thuyền,575441,0
bánh ngọt đang được nấu ở đâu,lò vi sóng,428599,3
cái gì dừng lại ở ngã tư ngoại ô,xe ô tô,365618,0
người đàn ông ở đâu,xe lăn,51052,3
màu sắc của con búp bê là gì,màu đỏ,256731,2
những gì gắn vào phía trước của một cửa hàng,đồng hồ,563731,0
có bao nhiêu hộp pizza đang ngồi trên bàn,bốn,531337,1
những gì đứng cạnh hàng rào gỗ,con voi,389316,0
màu sắc của đôi bốt là gì,màu đen,403592,2
những gì đứng bên ngoài tòa nhà ván gỗ,con cừu,379584,0
gấu bắc cực đang đi lang thang ở đâu,bồn tắm,323583,3
hai người đi xe đạp và xe đạp của họ phản chiếu qua đâu,gương,565447,3
nhóm người tập trung ở đâu,phòng,212633,3
những gì chứa đầy trái cây và rau các loại,hộp,374087,0
có bao nhiêu người cố gắng chặn người khác đang ném đĩa ném,một,492171,1
"những gì sơn màu đỏ, trắng và xanh",vòi,479195,0
con mèo đen lớn nghỉ ngơi ở đâu,giường,425470,3
những gì đang nghiêng về nhìn vào cốc,con mèo,387434,0
những gì chứa động vật nhựa trong một cảnh trang trại,bánh,405998,0
có bao nhiêu người đàn ông đeo kính và cà vạt đen cầm đồ đựng,năm,110761,1
những gì được phản chiếu trong kính của lò vi sóng,xe ô tô,577744,0
có bao nhiêu con ngựa vằn đang ăn cỏ,hai,529348,1
"những gì, được đặt gần tòa nhà",đồng hồ,387431,0
gấu đi lên một số tảng đá ở đâu,chuồng,535766,3
có bao nhiêu người đang đi trên con đường đất,hai,379781,1
những gì gặm cỏ trong một số mặt đất thưa thớt dưới ánh mặt trời,ngựa vằn,453649,0
vận động viên ném bóng chày đang tập ném bóng ở đâu,chuồng,324943,3
màu sắc của bông hoa là gì,màu tía,233677,2
những gì đầy trang sơ tường ở phía trước,ga-ra,551170,0
có bao nhiêu con ngựa vằn đang gặm cỏ trong khi một con khác quan sát từ phía sau,một,10733,1
những bông hoa màu hồng duy nhất ở đâu,lọ cắm hoa,427613,3
