question,answer,img_id,type
một vài người bạn cùng nhau ở đâu,phòng,350313,3
màu của lá là gì,màu xanh lá,85031,2
những gì bay ở khoảng cách với mặt trăng trong nền,máy bay,515531,0
người giữ bao nhiêu nửa bánh sandwich trong một tay và uống từ một ly rượu vang với mặt khác,một,565227,1
những gì giữ một chiếc bánh pizza phô mai trên bàn,đĩa ăn,553075,0
cái gì dựa vào cột trong một khu vực có hàng rào,con voi,535156,0
mèo ngủ ở đâu,giường,526225,3
trên đĩa có bánh mì tròn có bánh rán nào,sô cô la,399516,0
những gì nằm trên đỉnh đồi cỏ,băng ghế,405660,0
xe máy ở đâu,đường phố,460143,3
có bao nhiêu thanh niên thi nhau bắt đĩa bay,ba,427779,1
những gì đang đứng trên đỉnh của một chiếc đồng hồ trên một cột,bức tượng,545007,0
có bao nhiêu chiếc bánh mì kẹp giấy bị mắc kẹt trong cốc,ba,246641,1
những gì đỗ ở phía bên phải của một con đường,xe tải,510719,0
đống hành lý lớn ở đâu,kho,544719,3
những gì nằm bên cạnh máy tính trên bàn,laptop,499134,0
màu của mái nhà là gì,màu trắng,476127,2
anh chàng mặc những gì giữ một đĩa trắng,nón,394050,0
những gì được bao phủ bởi rất nhiều bông cải xanh và cà chua,bữa ăn,577321,0
những gì nằm bên cạnh máy nghe nhạc mp3 và các mặt hàng khác,máy vi tính,432859,0
màu của cái bát là gì,màu trắng,38134,2
cái gì đang nhìn ra cửa sổ ô tô,con chó,370210,0
một con mèo màu cam và trắng đang nằm ở đâu,chậu,65457,3
màu của sự lây lan là gì,màu cam,33417,2
cặp vợ chồng kéo là gì,xe đẩy,384513,0
nơi nào một số hươu cao cổ và đà điểu sống,vườn bách thú,278393,3
cô bé đang chuẩn bị thức ăn ở đâu,phòng bếp,148810,3
"những gì đang được kéo trên một đường đua, trước một ngôi nhà",con ngựa,398726,0
có bao nhiêu xe máy đang chạy trên đường báo hiệu một cuộc diễu hành,năm,236336,1
màu của tín hiệu là gì,màu đỏ,232114,2
những gì trên bầu trời ở bãi biển,diều,534444,0
"những gì xe kéo di chuyển trên đường phố, những người đi bộ ở bên cạnh nó",con ngựa,353807,0
nhà vệ sinh hiện đại nằm ở đâu,phòng tắm,71907,3
những gì bơi trong một ít nước gần một số thảm thực vật,con vịt,473015,0
màu của nước ép là gì,màu cam,569567,2
có bao nhiêu con ngựa vằn làm ở sở thú triển lãm lang thang trên đồng cỏ,ba,170428,1
có bao nhiêu người đang ở gần ván lướt sóng trên đại dương,hai,463839,1
màu của con chó là gì,màu đen,407196,2
có bao nhiêu ly rượu khác nhau được đặt trên một tờ giấy có dán nhãn,năm,13568,1
màu của mái nhà là gì,màu xanh lá,169845,2
có bao nhiêu con hươu cao cổ rúc vào cổ con hươu cao cổ khác,một,59151,1
màu của cỏ là gì,màu xanh lá,193709,2
hoa ở đâu trên bàn,lọ cắm hoa,469860,3
khay nhựa trong có bao nhiêu chiếc bánh rán khác nhau,bốn,32115,1
màu của cầu là gì,màu tía,181990,2
có bao nhiêu con chim xám lớn đi ngang qua sân,ba,162682,1
màu của cánh buồm là gì,màu vàng,324663,2
người với một hoddie giữ những gì,bàn chải,504621,0
cái gì đang đẩy ván trượt trong khi bọn trẻ đi bộ,con chó,372874,0
màu của bếp là gì,màu trắng,127495,2
những gì được hiển thị với quần áo trên đó,giường,546245,0
cái gì đang đỗ trên cỏ và một số người,động cơ,391810,0
màu của xe buýt là gì,màu đỏ,576012,2
có bao nhiêu người trượt tuyết tạo dáng chụp ảnh khi ở trên mặt đất,hai,315269,1
người đàn ông cưỡi những gì trên mặt đất phủ tuyết,ván trượt,505156,0
đàn ông có thể xem đồng thời bao nhiêu chiếc ti vi khác nhau,bốn,496053,1
xe đẩy nhựa ở đâu,phòng bếp,398349,3
cái gì đang ngồi bên dưới một ngôi nhà trên cây bằng gỗ và một chiếc xích đu lốp xe,gấu,438692,0
có bao nhiêu xe tải với quảng cáo của họ đậu cùng nhau trong lô,ba,559382,1
người chơi quần vợt giao bóng đang ở đâu,sân vận động,86292,3
cái gì đứng bên dưới cái cây bên cạnh bến du thuyền,hươu cao cổ,338607,0
ba người đàn ông trong đồng phục quân sự đã cắt gì,bánh,506458,0
có bao nhiêu đứa trẻ trong bộ quần áo tuyết lướt chậm trên đường trượt tuyết,bốn,351477,1
những người đàn ông đang thưởng thức một chiếc bánh pizza mới làm ở đâu,quán ăn,363719,3
những gì được hiển thị trong chiếc bình trong một căn phòng,hoa hồng,569464,0
một số ngựa đen trắng nâu ở đâu,chuồng,383210,3
những gì đang đứng bên ngoài trên cỏ gần hàng rào,ngựa rằn,526560,0
màu của bàn chải đánh răng là gì,màu xanh dương,139275,2
cái gì đang nằm trên bàn gỗ,pizza,569960,0
những gì đang dừng để nhận hành khách trên nền tảng,tàu hỏa,448410,0
màu của bàn chải đánh răng là gì,màu xanh dương,210416,2
có bao nhiêu con ngựa vằn con xuất hiện để tạo dáng trước một bụi cây ở vườn thú,ba,104098,1
người đàn ông mặc những gì đang chà nhám gỗ,mặt nạ,501122,0
có bao nhiêu pizza hình vuông một lạp xưởng thịt viên khác,hai,508582,1
người đàn ông đang quay trên ngón tay của mình là gì,dĩa nhựa,406676,0
màu của lá là gì,màu xanh lá,72905,2
màu của xe máy là gì,màu xanh dương,211449,2
màu của các tấm là gì,màu đỏ,18495,2
cái gì đè lên rèm cửa sổ,màn,344942,0
màu sắc của đại dương là gì,màu xanh dương,433637,2
màu sắc của người đàn ông là gì,màu xám,82255,2
màu sắc của thư giãn là gì,màu cam,491845,2
cái gì đang uống sữa từ mẹ nó,ngựa rằn,426075,0
những gì đang đứng đằng sau dấu hiệu cảnh báo,ngựa vằn,344314,0
điều gì đang lái xe trong giao thông xuống một con đường,xe buýt,439173,0
những gì lộn xộn với vật tư nấu ăn,quầy tính tiền,445658,0
màu của ngôi nhà là gì,màu trắng,180086,2
những gì nằm trên nhánh cây,con chim,435671,0
nhà vệ sinh ngồi ở đâu,phòng,497777,3
những gì được sử dụng để làm bình cho cây,chai,580608,0
cái gì bên cạnh cái ly có ống hút,xe tải,486369,0
cô gái đang giữ bàn chải đánh răng ở đâu,phòng tắm,414010,3
màu sắc của một,màu nâu,542814,2
"những gì đã làm trên đường, một người đàn ông thoát khỏi,",con voi,450728,0
điều gì đối mặt với hướng ngược lại trên đường băng,máy bay,524011,0
nhà vệ sinh phản chiếu trong gương ở đâu,phòng tắm,148771,3
con mèo đang nằm ở đâu,vali,96517,3
một vài đứa trẻ với ván trượt đứng ở đâu,đường phố,546473,3
người đàn ông cưỡi những gì xuống dốc tuyết phủ,ván trượt,415334,0
màu của con chó là gì,màu trắng,111583,2
con gì đi dọc theo hàng rào trong một khu vực kín,con voi,581726,0
 trẻ em học cách bơi ở đâu,hồ bơi,186856,3
màu của gấu là gì,màu đen,224878,2
có bao nhiêu chiếc máy bay đang đậu trên đường băng khô dưới bầu trời xanh,ba,535322,1
hoa màu tím được đặt ở đâu,lọ cắm hoa,483923,3
những gì kéo vào ga aubway nơi mọi người đứng,tàu hỏa,476279,0
có bao nhiêu màn hình đang ngồi cạnh nhau,hai,514156,1
có bao nhiêu người đứng trên đầu một ô tô trong khi hai người đứng cạnh ô tô cùng nhìn lên người đó,một,367763,1
màu của tủ lạnh là gì,màu đen,87126,2
người chơi bóng chày đang giữ những gì đang được quay bởi một người đàn ông máy ảnh,gậy,404923,0
những gì nằm trong hộp giấy,donut,497484,0
đang ăn cỏ gần mặt nước làm gì,con cừu,340272,0
người đàn ông đã thoát khỏi đâu,con thuyền,436717,3
những gì đứng trên một vỉa hè trống rỗng,đồng hồ,460149,0
cái gì ở trên với cái chảo đầy thức ăn,quầy tính tiền,505240,0
những gì ngồi trên bàn trên cùng,donut,543041,0
có bao nhiêu con hươu cao cổ đứng trên đống đá,hai,435913,1
những gì hiển thị `` màn hình xanh chết chóc '' hoặc lỗi nghiêm trọng thường liên quan đến các cửa sổ,máy vi tính,405188,0
những gì đang đứng trong rừng cây,hươu cao cổ,504414,0
"những gì nằm trên mặt đất, trong khi hai người đàn ông nói chuyện với nhau",con chó,401163,0
con bê nằm ở đâu khi mọi người tụ tập bên ngoài để nhìn,chuồng,418770,3
màu của chiếc đĩa là gì,màu trắng,23158,2
màu sắc của trang phục là gì,màu đen,396871,2
màu của dấu hiệu là gì,màu xanh dương,6426,2
màu của xe buýt là gì,màu trắng,260679,2
màu của xe buýt là gì,màu đỏ,251084,2
người phụ nữ đang đi xe đạp ở đâu,trạm,350122,3
một chiếc máy bay chiến đấu màu vàng cũ ở đâu,ga-ra,477029,3
ván lướt sóng đang được trưng bày ở đâu,văn phòng,309341,3
cái gì đang đỗ ở bên cạnh một tòa nhà,xe đạp,451896,0
những gì nằm trong một căn phòng bị bỏ hoang,bồn tắm,544597,0
người phụ nữ nằm ở đâu,giường,554711,3
ba con bò ăn một ít cỏ khô ở đâu,chuồng,309881,3
có gì trên cỏ,diều,550729,0
có bao nhiêu xe máy cảnh sát đang ngồi cạnh nhau trên bãi cỏ,ba,470423,1
màu của vali là gì,màu xanh dương,114079,2
người đàn ông đang rót gì vào ly,rượu,343248,0
những gì đang chăn thả trên cỏ bên đường,con ngựa,369849,0
có bao nhiêu người lướt sóng mà bức ảnh đen trắng hiển thị với bảng của họ,năm,395520,1
những gì đang đi qua rừng với những cây cao,hươu cao cổ,526645,0
những con bò đang được nuôi cái gì trong khi bị bỏ vào chuồng,cỏ khô,464286,0
những gì đứng cạnh nhau bên trên một cái chuồng,con bò,511349,0
có bao nhiêu cái bánh mì nướng đang ngồi trên đĩa uống nước,hai,284008,1
cái gì đang ngồi nhìn ra đại dương,băng ghế,377406,0
có bao nhiêu phụ nữ mặc váy hoa đang ngồi vào bàn,bốn,430257,1
cái gì đã bị tuyết bao phủ một nửa,vòi,356181,0
cái gì đang ăn lá cây,hươu cao cổ,335033,0
màu của xe buýt là gì,màu vàng,358781,2
màu của lông là gì,màu xanh dương,563559,2
người đang chụp ảnh ở đâu,gương,127301,3
những gì bên cạnh một con mèo ngoài trời trong tuyết,con cừu,531710,0
những gì gặm cỏ trên bụi cây trong một cánh đồng mở,hươu cao cổ,394611,0
những thứ và hành lý nhiều màu nằm rải rác trên sàn nhà,túi,374649,0
nhóm người già và trẻ đang chơi gì,dĩa nhựa,470117,0
đống lớn của miếng nhựa đen daniels nằm ở đâu,chậu,412190,3
con tàu đang chạy vòng cạnh những cái cây là gì,đường ray,558421,0
những gì nằm trên quầy trong văn phòng của một bác sĩ chỉnh hình,thùng chứa,410924,0
màu sắc của hành tây là gì,màu xanh lá,108914,2
nhóm người làm việc ở đâu,phòng bếp,66231,3
có bao nhiêu chai rượu đơn lẻ trong một tủ lạnh rỗng,hai,430677,1
màu của bông hoa là gì,màu tía,466671,2
những gì đang đỗ bên cạnh nhà ga,xe lửa,528811,0
người đàn ông phục vụ gì với một trong những người bạn của mình,quả táo,537506,0
cái gì được bao phủ bởi rất nhiều tuyết,núi,578813,0
con mèo đang nằm ở đâu,cái ghế,339987,3
màu sắc của các tòa nhà là gì,màu đỏ,394970,2
cái gì đang ngồi trên bàn,máy tính,454982,0
có bao nhiêu bồn rửa dưới gương và ánh sáng trên tường,hai,570586,1
con mèo đen ngồi ở đâu,chậu,284623,3
những gì đang nghỉ ngơi trên ghế có chăn trên đó,con chó,437231,0
những gì ăn cỏ một mình bởi một hồ nước,con cừu,546980,0
màu sắc của bông hoa là gì,màu vàng,402957,2
có bao nhiêu đường biển báo trước cây,một,25885,1
người đàn ông đang làm gì đó ở đâu,phòng,499978,3
cái gì đang nằm yên trên cuộn băng trong,cây kéo,348012,0
cậu bé đang ăn bánh ngọt ở đâu,cửa hàng,508281,3
màu của biển là gì,màu xanh dương,155221,2
có một người đàn ông cầm một cái sào và lái cái gì,ván lướt sóng,560646,0
những gì bay trong gió phía trên bãi cát,diều,413146,0
cái gì đang ngồi bên cạnh máy tính,bia,346638,0
có bao nhiêu người đang mỉm cười và cầm ly rượu,bốn,387075,1
những gì chứa đầy đồ nội thất và tv,phòng,429593,0
những gì ở gần những người nhìn một hẻm núi,vòi,569273,0
một con mèo cam ngồi ở đâu,cái ghế,178178,3
màu sắc của khán đài là gì,màu xám,54706,2
có bao nhiêu người đang ngồi bên cạnh một ván lướt sóng trên bãi biển,ba,560851,1
màu của bàn phím là gì,màu đen,142534,2
màu của tường là gì,màu xám,539675,2
có bao nhiêu người đàn ông đứng cạnh nhau cầm bộ điều khiển wii,hai,158680,1
cái gì xếp hàng trước biểu tượng billabong,ván lướt sóng,378701,0
người đàn ông cầm ba lô đứng cạnh một người đàn ông mặc gì,bộ đồ,502327,0
những gì đang đứng cùng nhau trong một cánh đồng cỏ,ngựa vằn,546011,0
đàn ông mặc đồ bơi ở đâu,hồ bơi,378137,3
gấu đồ chơi nhồi bông ở đâu,cái ghế,252457,3
cái gì đang ngồi trên đĩa trắng,pizza,365305,0
những gì đang đeo nơ trắng và nhìn vào camera,con mèo,534942,0
có bao nhiêu người phụ nữ ở đó làm món tráng miệng trong bếp,hai,61773,1
những gì có nhiều máy tính và các vật tư khác nhau,cái bàn,493753,0
một số phụ nữ đang chuẩn bị một số thực phẩm ở đâu,phòng bếp,363919,3
có bao nhiêu con ngựa vằn đang tụ tập quanh mặt nước dưới lều,bốn,278793,1
cô gái trẻ nhỏ đang đi đâu bên cạnh một cái cây,con ngựa,400950,0
màu của nhà vệ sinh là gì,màu trắng,274356,2
những gì được chuẩn bị với hai miếng cá,sandwich,373789,0
đóng cửa trái cây và rau quả ở đâu,cửa hàng,570016,3
cây xanh đang ăn gì,hươu cao cổ,360132,0
có bao nhiêu người lướt sóng đang hoàn thành cuộc chạy của họ trên những con sóng nhỏ,hai,50511,1
những gì đang đi trong bụi bẩn,ngựa rằn,447194,0
con búp bê đang tắm ở đâu,phòng tắm,335087,3
những gì được hiển thị bên dưới nhu yếu phẩm du lịch dấu hiệu,gấu,373440,0
người đàn ông tóc vàng đang chụp ảnh ở đâu,áo vest,553051,3
cái gì dừng lại ở nhà ga bên cạnh một tín hiệu giao thông,tàu hỏa,346954,0
những bàn phím nào nằm trên bàn,máy vi tính,495973,0
có bao nhiêu người ngồi trên bàn với ly rượu,ba,450317,1
hai hươu cao cổ đứng ở đâu,điện thoại,73591,3
có bao nhiêu người lái máy trên mặt nước trong khi một người khác bị treo ở phía sau,một,85252,1
những gì đang đi với em bé của nó,con voi,518365,0
những gì chống đỡ trên bãi biển đông đúc,con thuyền,461016,0
màu sắc của chiếc váy là gì,màu xanh dương,202431,2
tủ lạnh nhỏ ở đâu,phòng bếp,63974,3
màu của dĩa nhựa là gì,màu vàng,162828,2
mèo tam thể trắng và mèo mướp ở đâu,giường,580234,3
hai hươu cao cổ đứng ở đâu,lồng,524531,3
chưa hoàn thành những gì chỉ với một đế vòi hoa sen được lắp đặt,phòng tắm,382734,0
người phụ nữ đánh giá ô dù vẽ tay ở đâu,phòng,315168,3
những gì được nhìn thấy trên đường phố bên ngoài một tòa nhà cao tầng,xe ô tô,412676,0
những gì bay trên những ngọn đồi phía trên một bờ biển phát triển,máy bay,502347,0
màu của chiếc đĩa là gì,màu trắng,542138,2
có bao nhiêu máy tính xách tay đặt trên một cái bàn gỗ và tất cả các máy tính đều bật,ba,137918,1
những gì dừng lại ở lề đường trên bãi cỏ với hoa,xe đẩy,395752,0
những gì bên cạnh một chiếc xe màu xanh,con ngựa,386581,0
những gì treo bên cạnh lò pizza,mái chèo,533281,0
mèo xiêm đánh hơi hoa vàng và đỏ ở đâu,lọ cắm hoa,138699,3
người đàn ông mặc đồ da những gì,xe máy,413822,0
những gì chọc vào chân của nó tại một tấm gương và nhìn vào sự phản chiếu của nó,con mèo,411665,0
có bao nhiêu người đang làm trò trượt ván trên tuyết và nhảy trong tuyết,một,246971,1
năm cái bánh rán còn lại ở đâu,hộp,102589,3
những gì đang cúi xuống ăn một ít cỏ,ngựa rằn,445439,0
màu của vòi nước là gì,màu trắng,304065,2
tất cả có bao nhiêu con ngựa vằn cho thấy sự ủng hộ của họ trong khi gặm cỏ,ba,505919,1
có bao nhiêu người đàn ông đang ngồi dưới ô trên vỉa hè,hai,40083,1
có bao nhiêu người đàn ông đang ngồi trên bàn và nhìn vào điện thoại của anh ấy,hai,210374,1
những gì nằm bên cạnh một chiếc bánh pizza chưa nấu chín,pizza,408906,0
có bao nhiêu người đang mặc đồ trượt tuyết đứng trên một khu vực cao,hai,534633,1
trên chảo có lớp vỏ nào với rau,pizza,342933,0
người phụ nữ ôm mặt cái gì,hươu cao cổ,470714,0
cái gì đang được cho ăn sữa,con mèo,485613,0
ba người tìm kiếm gì khi ngồi ở bàn,điện thoại,537270,0
ngủ trên một số tảng đá là gì,gấu,432414,0
"cái gì đang ngồi trên bàn di chuột nhiều màu, bên cạnh một chiếc ipod",chuột,568982,0
những gì đang hướng đến và hoặc từ manchester,xe buýt,533408,0
những gì đang ngồi trên đỉnh của một con đường,máy bay,457684,0
người đàn ông đang ăn bánh cupcake ở đâu,văn phòng,357385,3
những gì lái dọc theo con phố qua những cây cọ vào một ngày nhiều mây,xe ô tô,473050,0
những gì đang đi xuống con đường quanh co,xe ô tô,473214,0
người phụ nữ đang mỉm cười ở đâu,phòng bếp,90255,3
bàn văn phòng tại nhà có hỗ trợ máy tính xách tay và máy in ở đâu,ngăn kéo,127558,3
những con ruồi trên bầu trời xanh sáng,hải âu,389129,0
màu của dĩa nhựa là gì,màu tía,206636,2
màu của con mèo là gì,màu cam,415604,2
màu của bầu trời là gì,màu xám,299050,2
cái gì đang ngồi trên bàn nhỏ,laptop,523096,0
cái gì đang đỗ bên ngoài quán cà phê,xe máy,510340,0
những gì đỗ bên trong cửa hàng gần lối vào,xe đạp,401550,0
con bò lớn màu nâu nằm ở đâu,đường phố,422295,3
một chiếc xe cũ đang đậu ở đâu,đường phố,222489,3
bao nhiêu xe bán tải đậu trên vỉa hè đối diện nhau,hai,237207,1
em bé nằm ở đâu trên bộ ga giường màu hồng,phương tiện giao thông,178504,3
màu sắc của cánh là gì,màu vàng,216036,2
màu của chiếc thuyền là gì,màu xanh lá,556207,2
"những gì đứng gần cây cầu và các cấu trúc loại lớn, cổ điển lớn khác",tòa tháp,528578,0
người phụ nữ ném một chiếc dĩa nhựa màu xanh trên cỏ xanh được bao phủ là gì,đồi,438989,0
màu của bìa là gì,màu cam,438314,2
ăn cỏ khô gần một hàng rào là gì,con cừu,434263,0
những gì đang ngồi trên giường hơi làm,laptop,538963,0
những gì được hiển thị với sự đa dạng của các mặt hàng trên quầy,phòng bếp,384213,0
màu của các container là gì,màu vàng,575199,2
những gì chuẩn bị hạ cánh trên đường băng,máy bay,532338,0
con hươu cao cổ ăn gì,cỏ khô,502752,0
những gì chứa đầy xúc xích ngồi trên bàn ngoài trời,đĩa ăn,536708,0
cái gì nằm bên cạnh thác nước với một cái ao,băng ghế,336340,0
màu sắc của người phụ nữ là gì,màu đen,26321,2
có bao nhiêu người đàn ông đang cố gắng bắt trò ném đĩa ở công viên,hai,103252,1
cái gì đang băng qua đường trong khi một chiếc xe jeep đang đậu đang quan sát,con voi,555472,0
có bao nhiêu máy tính xách tay đang được sử dụng trên một chiếc bàn trắng,ba,174247,1
điều gì đang nhìn theo hướng của máy ảnh,con voi,488368,0
những gì đang trên đường đua với nhiều xe đằng sau nó,tàu hỏa,440508,0
người cầm thứ làm từ miếng cà rốt,điêu khắc,442301,0
"những gì, với một chiếc cà vạt và áo khoác",áo sơ mi,438426,0
có bao nhiêu chàng trai đang đi dạo trên bãi biển mang theo ván lướt sóng của họ,hai,10445,1
một số hoa hồng cắm ở đâu,lọ cắm hoa,510034,3
màu của ghế là gì,màu nâu,465906,2
có bao nhiêu chàng trai đang chơi wii ,ba,573611,1
người đàn ông đang đi bộ bên ngoài gần xe buýt và tòa nhà ở đâu,đường,237064,3
những gì chứa đầy hoa được đặt trên đỉnh của một bàn gỗ,bát,467951,0
hai quả táo và hai trái chuối đang nằm ở đâu,cái rổ,276781,3
những gì đầy tuyết gần một vài cây khác,băng ghế,401124,0
màu của xe buýt là gì,màu xanh dương,128351,2
những gì đang xảy ra tải xe đạp,xe tải,551952,0
những gì được dừng lại trên đường ray để đón khách,tàu hỏa,346083,0
cái gì lăn lộn lưng nó trên một cánh đồng,ngựa rằn,536235,0
những gì được sơn với các sọc trên cùng màu xanh và đỏ và trắng,vòi,479195,0
có bao nhiêu người đàn ông ở bàn dưới lều đang bán cà vạt,hai,397303,1
có bao nhiêu người bay tham gia với tư cách là nhóm trong một cánh diều hình tròn `` ba lê '',chín,32906,1
cái gì đang ngồi trên máy tính xách tay,con mèo,446352,0
nhà vệ sinh trắng đang nằm ở đâu,phòng tắm,43340,3
người đàn ông đang phục vụ pizza ở đâu,gian hàng,95241,3
có gì trên đường băng chuẩn bị tải hoặc dỡ hàng,máy bay,540697,0
màu của thảm là gì,màu xám,355344,2
những gì đang ngồi trên giá đỡ trên một nhà vệ sinh,khăn,531023,0
màu của con chó là gì,màu đen,546261,2
người đàn ông ăn mặc đẹp đang chờ ở đâu,sân vườn,485595,3
những gì chứa đầy nhiều món ăn,quầy tính tiền,429366,0
những gì đã thay đổi để phù hợp với nhu cầu của người khuyết tật,phòng tắm,564699,0
những gì đỗ trong bãi đậu xe bẩn,xe máy,449768,0
những gì đang đứng gần con dê và một con vịt,con cừu,557150,0
người phụ nữ đang làm việc ở đâu,phòng bếp,368474,3
những chiếc xe kéo được dừng lại ở ga tàu,tàu hỏa,423215,0
cái gì đang ngồi trên đỉnh đồi xanh bên cạnh đại dương,băng ghế,377406,0
điều gì sắp cất cánh từ nhà ga,máy bay,503292,0
cái gì vậy mà cái đống lát lại nằm trên cái đĩa thủy tinh,sandwich,361739,0
khoai tây và hẹ hầm ở đâu,món ăn,310546,3
có bao nhiêu người mỉm cười khi họ đang tạo dáng gần nhau,năm,207058,1
có bao nhiêu phụ nữ trong bếp với một đĩa mì ý,hai,396691,1
những gì đang ăn ếch trong một đầm lầy,con chim,475223,0
những gì đỗ trên đường băng,máy bay,521472,0
những gì đang ngồi trên đường băng,máy bay,396673,0
có bao nhiêu thanh niên cưỡi ván trượt trên mặt phẳng,hai,292478,1
con mèo đang cuộn tròn ở đâu,bát,548498,3
cái gì đậu trên đường bên cạnh mặt nước,phương tiện giao thông,374485,0
có bao nhiêu con vịt đứng trên bãi biển đối mặt với mặt nước,ba,259248,1
màu của vòi nước là gì,màu vàng,173688,2
những gì trên đường phố,xe buýt,525542,0
một quả táo một quả quýt đồ uống gì và các mặt hàng thực phẩm khác,cà rốt,437789,0
màu của con mèo là gì,màu nâu,198561,2
có bao nhiêu người đàn ông đang làm việc trong nhà bếp thương mại để dọn dẹp và chuẩn bị thức ăn,ba,525180,1
"những gì chứa đầy bút chơi cho bé, tv màn hình phẳng và đồ nội thất",phòng,398209,0
có một người đàn ông đeo kính và ăn những gì,donut,400573,0
người đàn ông có râu ăn ở đâu,văn phòng,361469,3
"cái gì đang đứng thẳng trên bãi cỏ, được nâng đỡ bằng xe lăn",ván lướt sóng,353909,0
màu sắc của sneaker là gì,màu trắng,63345,2
những gì prop máy bay lướt trên mặt nước,động cơ,406119,0
cặp vợ chồng xe tay ga đang ở đâu,tòa nhà,486595,3
