question,answer,img_id,type
có bao nhiêu người trượt tuyết đặt ra cho hình ảnh trên tuyết,hai,308027,1
con chó đang ngồi ở đâu,chậu,333407,3
cây được trưng bày ở đâu trên kệ,thùng chứa,203692,3
màu của chiếc hộp là gì,màu xanh dương,555625,2
có bao nhiêu người đàn ông leo núi lúc mặt trời mọc,ba,355678,1
những gì đang ngồi trên khúc gỗ lười biếng ngáp,gấu trúc,388766,0
có bao nhiêu con mèo ăn trong nền trong khi một con khác nhìn chằm chằm về phía trước,một,223932,1
những gì đang nằm trên chảo kim loại,pizza,556478,0
những gì đang ngồi cạnh nhau trong hộp,pizza,385873,0
cái gì nằm trên cái đĩa trắng,sandwich,346262,0
màu của phòng tắm là gì,màu trắng,332427,2
màu của chiếc thuyền là gì,màu trắng,557308,2
surfer với một bộ đồ ướt mang theo là gì,ván lướt sóng,400907,0
có bao nhiêu người trong trang phục công sở đang thảo luận quanh bàn,năm,124580,1
cuộc gọi trắng của người lớn đang ngủ ở đâu,quả bóng,275371,3
những gì mặc kính râm khi nó nằm trong một chiếc xe hơi,con chó,569729,0
màu của con ngựa là gì,màu nâu,486247,2
hoa loa kèn được đặt ở đâu,lọ cắm hoa,17921,3
những gì đã cập bến bởi một số thuyền nhỏ hơn,con thuyền,573709,0
hai người đàn ông và hai người phụ nữ đang uống ở đâu,quán bar,175798,3
nhóm người đi xuống vỉa hè là gì,bảng,385196,0
một người và vali ở đâu,xe tải,438841,3
có bao nhiêu phụ nữ đang ngồi trên đồ nội thất bãi cỏ gần thùng gỗ,bốn,399138,1
màu của bồn rửa là gì,màu trắng,195712,2
màu của cà vạt là gì,màu vàng,472519,2
nam thanh niên đang sử dụng cái gì,ván trượt,367710,0
những gì đang ngồi cạnh cây và một hàng rào,con bò,502798,0
những gì bay trên bầu trời đầy mây,máy bay,532338,0
những gì đang được chuẩn bị trên chảo,pizza,408906,0
màu của chuối là gì,màu xanh lá,176758,2
bí ngô và các loại rau khác ở đâu,chảo,486159,3
màu của vòi nước là gì,màu trắng,135303,2
có bao nhiêu máy tính nối mạng đang ngồi tại một trạm làm việc,bốn,465825,1
người đàn ông đang giữ điện thoại di động ở đâu,phòng,39065,3
cái gì một bồn rửa và lò vi sóng,công cụ,460378,0
cô gái đi bên cạnh một cái cây là gì,con ngựa,400950,0
những gì đang ngồi bên cạnh một con đường ẩm ướt,tòa nhà,417265,0
những gì được bao quanh bởi cây xanh,tòa tháp,349678,0
màu của căn phòng là gì,màu xanh lá,441058,2
màu của con bò là gì,màu nâu,186275,2
một tòa nhà bằng gạch và đá cũ cao bao nhiêu tầng,ba,79588,1
có bao nhiêu con cừu đang chăn thả trên đồng cỏ gần hàng rào dây thép,hai,149253,1
màu của chiếc bình là gì,màu tía,418808,2
những gì đang đứng trong đám cỏ cao và bụi rậm,ngựa rằn,569674,0
người đàn ông chuẩn bị bánh sandwich ở đâu,quán ăn,168173,3
rèm treo ở đâu,phòng tắm,301783,3
phụ nữ lớn tuổi đang cầm cái gì,laptop,556862,0
có gì ở một sân bay với bầu trời nhiều mây,máy bay,450483,0
người đàn ông đang ngồi ở đâu,xe ô tô,389577,3
"kỳ lạ, có bao nhiêu biển báo trên một ngọn đồi cách xa dòng xe cộ",bốn,169589,1
người đàn ông mặc gì khi cầm một con chim,găng tay,440529,0
con chó đang đội mũ ở đâu,xe ô tô,311190,3
có bao nhiêu chiếc ô đầy màu sắc đang treo trên không trung,ba,215374,1
màu của cửa là gì,màu nâu,415335,2
những gì đang đi trên bãi biển,con bò,525665,0
màu của con mèo là gì,màu đen,502604,2
ngựa nâu và trắng đang ăn một số cỏ xanh ở đâu,chuồng,311957,3
những gì được xếp chồng lên tường gạch,vali,458079,0
có bao nhiêu người trượt tuyết đang đứng cạnh nhau trên tuyết,ba,430193,1
màu của cupcake là gì,màu xanh lá,285562,2
những gì đang nhìn vào máy tính xách tay để nằm trên một hàng rào,con mèo,409247,0
có bao nhiêu bồn tiểu được gắn trên tường gạch,bốn,139971,1
xe buýt du lịch đang ở đâu,đường,137826,3
màu sắc của bông hoa là gì,màu vàng,518883,2
những gì đỗ bên cạnh đồng hồ đỗ xe trước nhà để xe,xe ô tô,471097,0
có gì đang đi trong một khu vực cỏ,hươu cao cổ,410231,0
người đàn ông đội mũ bảo hiểm ở đâu,gương,378375,3
màu của chiếc đĩa là gì,màu trắng,352835,2
có bao nhiêu con ngựa vằn đang đứng trên cỏ bên cây,ba,504635,1
có bao nhiêu con hươu cao cổ đang ăn trong vườn thú,hai,7697,1
có bao nhiêu con hươu cao cổ đang gặm cỏ trong một khu vực có cây cối,ba,24847,1
những gì đầy màu sắc và trông ngon miệng và phong phú,rau xà lách,566687,0
người phụ nữ đang chụp ảnh mình ở đâu,phòng tắm,387408,3
có bao nhiêu chiếc bánh pizza cỡ cá nhân trên bàn,ba,485288,1
những gì được âu yếm với nhau trên một con chó khác,con chó,531334,0
có bao nhiêu máy bay quân sự đang bay trong đội hình,sáu,244206,1
thứ gì bắn tung tóe với sơn nằm trên cánh đồng,xe tải,485532,0
màu của crouches là gì,màu đen,429113,2
màu của tường là gì,màu xanh lá,299974,2
màu của vùng đất là gì,màu xanh lá,371628,2
màu của chiếc cặp là gì,màu vàng,260167,2
màu của bài là gì,màu xanh lá,212501,2
những bông hoa màu hồng duy nhất ở đâu,lọ cắm hoa,427613,3
có bao nhiêu người đàn ông ăn mặc đẹp uống bia và ăn pizza,sáu,77195,1
cái gì bên cạnh bức tường màu vàng,vòi,348648,0
có bao nhiêu con voi đang đứng cùng nhau trong một vùng cỏ hoang dã,ba,286724,1
những gì ngồi đỗ trước một hiệu sách,xe đạp,535808,0
có bao nhiêu con hươu cao cổ đứng cạnh nhau trước cây,hai,452341,1
màu của bầu trời là gì,màu xanh dương,397010,2
có bao nhiêu người đàn ông mặc quân phục cùng với hai người đàn ông khác đang cắt bánh,hai,229896,1
gấu bông nhỏ đang ngồi ở đâu,cái ghế,52992,3
người đàn ông trên xe đạp đang chuẩn bị đồ uống ở đâu khi phụ nữ đứng gần đó,máy xay,507444,3
bức tranh được hiển thị ở đâu,phòng,188818,3
con chó nhỏ nằm ở đâu,cái ghế,411875,3
em bé nhỏ đang tắm ở đâu,chậu,150017,3
những người hâm mộ khúc côn cầu ở đâu,đường phố,311076,3
màu của tủ lạnh là gì,màu trắng,523390,2
màu của chiếc ô là gì,màu tía,276750,2
những gì có chiếc ghế được sắp xếp rất tốt,nhà ở,558673,0
người phụ nữ nhìn ở đâu,gương,224938,3
màu của con mèo là gì,màu trắng,87629,2
có bao nhiêu hình ảnh chiếu cùng một chiếc tivi với những thứ khác nhau trên màn hình,sáu,224699,1
một số người một thị trường ngoài trời và một con ngựa nâu kéo những gì,xe đẩy,509766,0
màu của chiếc thuyền là gì,màu xanh dương,322059,2
có bao nhiêu chú mèo con cuộn tròn trong tấm bìa trắng trông mềm mại,hai,45108,1
màu của lửa là gì,màu vàng,572804,2
cái gì nhìn qua gỗ để xem những gì ở phía trước,gấu,378765,0
những gì đang ngồi trên bàn và được bật,laptop,385641,0
có bao nhiêu người phụ nữ đang nhìn chuối ở một khu chợ mở,hai,183594,1
màu sắc của những con chó là gì,màu nâu,132165,2
người đang nằm ở đâu,giường,436468,3
màu của gối là gì,màu đỏ,35573,2
những gì ngồi trước một số món ăn giáng sinh,chuối,347568,0
con mèo lớn nằm ở đâu,cái rổ,419273,3
màu của cà vạt là gì,màu xanh dương,495988,2
có bao nhiêu con hươu cao cổ đang đứng cạnh nhau khi chúng ăn cây,hai,523183,1
"những gì chứa đầy giày, một chiếc áo và một phần xe đạp",vali,534349,0
những cái đầu là gì trong khi ngồi trên đá,gấu,399921,0
những gì đỗ trên vỉa hè bên ngoài tòa nhà gạch,xe đạp,429497,0
máy bay trực thăng lớn ở đâu trong khi máy bay lớn ở bên ngoài,ga-ra,302481,3
gấu bông nằm ở đâu,giường,374133,3
xây dựng gạch lớn đang diễn ra là gì,đồng hồ,547440,0
những gì nhưng đang ngồi trên sàn nhà,lò vi sóng,472595,0
đồng hồ gắn ở đâu,hành lang,222686,3
màu sắc của quần áo là gì,màu cam,565081,2
bảy bánh rán ngồi ở đâu,chảo,203388,3
cậu bé đang đánh răng ở đâu,gương,538349,3
cái gì đang đậu trên lưng con vật có sừng,con chim,381368,0
những gì đang di chuyển dọc theo các đường ray bên cạnh một ngôi nhà,tàu hỏa,461628,0
màu của vali là gì,màu xanh dương,75084,2
màu của động cơ là gì,màu xanh lá,59618,2
màu của những đám mây là gì,màu xám,356097,2
nhóm trẻ em được quay ở đâu khi họ chơi trên ipad,lớp học,486644,3
những gì đang chơi với miệng của nó mở,gấu,499104,0
con bê trên cánh đồng gọi là gì,gia súc,572408,0
hai tàu dừng lại ở đâu,trạm,446199,3
những gì đi bộ xuống một thảm cỏ rộng mở,hươu cao cổ,434735,0
bạn của con chó này là gì,gấu,537636,0
ngựa vằn đang ăn gì bên cạnh hàng rào,bãi cỏ,445439,0
có bao nhiêu nam vận động viên trượt ván trên bàn tuyết và xe tải màu đỏ,ba,372430,1
có bao nhiêu biển hiệu được treo liên tiếp ở phía trước của một tòa nhà sang trọng,bốn,457708,1
màu của con bò là gì,màu đen,563578,2
những gì đang lái xe xuống phố,xe buýt,533408,0
những gì chuyến tàu đi qua vùng nông thôn xanh nông thôn,màu cam,440508,0
con mèo nằm ở đâu,chậu,501523,3
những gì đang phát triển bởi một hàng rào đường sắt gỗ và một chuyến tàu,bông hoa,493395,0
ba vận động viên trượt tuyết nâng lên bầu trời là gì,núi,434618,0
màu của cây là gì,màu xanh lá,212514,2
người đàn ông đang ngồi ăn gì vậy,bánh ngọt,357385,0
cô gái đang ngồi ở đâu trong khi cô ấy trên điện thoại của mình,cái ghế,28012,3
những gì nằm trên thớt gỗ,sandwich,412767,0
có gì đứng một mình trong tự nhiên,ngựa rằn,400336,0
có bao nhiêu máy bay đang bay trong hình thành trên bầu trời,bốn,506371,1
màu của chiếc tàu là gì,màu đỏ,80283,2
"cái gì là hai lớn, trong một cái bình lớn",bông hoa,555972,0
màu của tòa nhà là gì,màu đỏ,107705,2
điều gì làm cho lượt trên đường phố ở thành phố new york,xe buýt,405614,0
giao lộ có đèn dừng là gì,xe ô tô,338105,0
một chiếc giường lớn và một cái ghế nằm ở đâu,phòng,480594,3
có bao nhiêu người đàn ông đang chơi trò chơi điện tử trong phòng khách,hai,544850,1
những bông hoa hướng dương cắm ở đâu,lọ cắm hoa,25377,3
các công cụ nằm ở đâu,phòng tắm,59515,3
màu của chiếc mũ là gì,màu đen,458960,2
có bao nhiêu con hươu cao cổ đang hướng lên trên đồi,bốn,538557,1
những gì bay qua cách chạy rộng lớn,máy bay,392670,0
những gì ngồi trên khăn ăn bên cạnh bát súp,sandwich,497439,0
cái gì đứng trong tuyết bên trong hàng rào,con chó,359569,0
những gì đỗ trên đường phố bằng một đồng hồ đỗ xe,xe ô tô,387150,0
những gì nằm ở bên cạnh một tòa nhà,đồng hồ,551780,0
hai người đàn ông ngồi ở đâu,phòng,402042,3
hai người phụ nữ trong phòng tắm đánh răng một người phụ nữ cầm cái gì vậy?,máy ảnh,349590,0
con hươu cao cổ nằm ở đâu,chuồng,333048,3
có bao nhiêu cầu thủ bóng chày tình cờ đứng với nhau,ba,246390,1
những gì chất đống với đống hành lý rất cao,xe đẩy,374352,0
có bao nhiêu người đàn ông xung quanh bàn với thức ăn trên đó,năm,86668,1
những gì với giỏ hành lý và những người chờ đợi,trạm,458079,0
những gì được kéo lên đến khu vực hành khách,xe lửa,559955,0
nhà bếp sạch sẽ và ánh sáng đến từ đâu,cửa sổ,245857,3
người đàn ông mặc gì trong khi giữ điện thoại của mình,mặt nạ,530383,0
bao nhiêu người đi xe máy xuống phố trong khi những người khác nhìn vào,hai,221633,1
những gì đã che phủ mây che phủ phía trên một khu rừng,núi,515422,0
hai người đang ở đâu,phòng ngủ,37326,3
màu của chiếc giường là gì,màu trắng,417814,2
người phụ nữ cầm cái gì  đang nhìn một đứa trẻ đang phấn khích trên ghế cao,bánh,379837,0
màu của bồn là gì,màu trắng,488295,2
những gì đang ngồi trên một tờ giấy nhàu nát,con mèo,502275,0
con mèo đang ngồi ở đâu,chậu,410533,3
công nhân lái xe gì chở hàng,xe đẩy,457054,0
cái gì đang đỗ trên đường,xe buýt,548879,0
màu của chiếc mũ là gì,màu đỏ,410561,2
có bao nhiêu đứa trẻ đang ngồi trên một chiếc ghế dài gần cây,ba,440045,1
bếp gỗ cũ ở đâu,phòng bếp,341894,3
gây gặm cỏ trên đồng bằng cỏ,con bò,459487,0
màu của gấu là gì,màu xám,2770,2
cái gì đậu ở phía trước của một đồng hồ đậu xe,xe đạp,370208,0
những gì đang bay trên bãi biển,diều,421865,0
cái gì đang đỗ ở bên đường,xe buýt,505162,0
người phụ nữ và hai người đàn ông đang làm gì xung quanh một cái bàn,pizza,492107,0
mọi người đang đi đâu,sân bay,187253,3
chuối một số cam là một con dao và thớt bát,táo,392850,0
những gì đỗ ở nhà ga,xe buýt,510842,0
cò đứng ở đâu,đường phố,577146,3
những gì đang treo ngược trên dây,con chim,470032,0
những gì chứa một tai ngô và một món salad mì ống với rau và trứng,đĩa ăn,566502,0
có bao nhiêu người đứng trên một nền tảng gần một chuyến tàu,ba,308139,1
màu của bệ là gì,màu nâu,114219,2
có bao nhiêu người đang chất con ngựa vào một chiếc xe kéo ngựa,ba,97924,1
có bao nhiêu con ngựa và chúng được thể hiện bằng màu đen và trắng,hai,491666,1
người đàn ông mặc gì và được che bởi một chiếc ô đang sử dụng điện thoại di động của anh ấy,nón,371564,0
người đàn ông đang xem cái gì bay qua không trung,diều,352552,0
màu của màn là gì,màu trắng,330770,2
có bao nhiêu đứa trẻ đang chơi ván trượt trên một con phố dân cư,hai,471915,1
con mèo đen trắng đang ngồi ở đâu,chậu,502204,3
người đang cầm bánh rán ở đâu,cái túi,258725,3
màu của xe máy là gì,màu xanh lá,8944,2
những gì phục vụ với brocclie trên bàn,bữa ăn tối,526028,0
màu của áo là gì,màu xanh dương,394483,2
nắp bát nhà vệ sinh nằm ở đâu khi các thông báo nằm trên tường đằng sau nó,chuồng,260285,3
một chiếc máy bay chiến tranh cũ đang ở đâu,ga-ra,423749,3
miếng bánh sô cô la ở đâu,thùng chứa,190426,3
những gì đặt trước một bức tường gạch,băng ghế,576941,0
màu của lửa là gì,màu đỏ,313820,2
màu của các loại hạt là gì,màu xanh lá,481120,2
những gì nằm trên kệ dưới đồng hồ thời gian đục lỗ,nón,417159,0
những gì có vẻ rất thấp đến sàn,nhà vệ sinh,404608,0
màu của lá là gì,màu xanh lá,39993,2
những gì cánh dài bay trên một đại dương xanh thẳm,con chim,388881,0
màu của máng là gì,màu xanh dương,366975,2
hai người đàn ông không áo giữ những gì trước mặt họ,ván lướt sóng,475184,0
có bao nhiêu người đi xe tay ga trên đường thành phố,hai,498218,1
những gì chứa đầy mặt quầy màu đen và một lò nướng trên mặt bếp màu đen,phòng bếp,337815,0
những gì đang đi bên cạnh một con ngựa vằn bên ngoài,hươu cao cổ,494679,0
bồn rửa trắng đang đặt ở đâu,vòi hoa sen,569887,3
những gì bên ngoài một cửa sổ lớn,xe đạp,347982,0
những gì đứng trên vũng nước tại một sở thú,con voi,392985,0
màu của chiếc tàu là gì,màu đỏ,393617,2
gấu bắc cực đang ở đâu,vườn bách thú,472181,3
chomping trên giỏ thức ăn của họ là gì,hươu cao cổ,552073,0
màu của áo là gì,màu đen,269360,2
xe cứu hỏa màu đỏ đậu ở đâu,trạm,292662,3
một vài người ở đâu trong khi những người khác đang xem,đường bộ,395216,3
những gì về việc có được trong nước với hai con voi đã có trong đó,con voi,384718,0
người thả gì,diều,470658,0
màu sắc của bông hoa là gì,màu tía,349621,2
con chó lớn cuộn tròn ở đâu,giường,168769,3
có bao nhiêu cầu thủ bóng chày trên sân được cắt tỉa cẩn thận,ba,290875,1
xe tay ga ở đâu,ga-ra,569356,3
có bao nhiêu con hươu cao cổ đang ăn trong khi những con hươu cao cổ khác quan sát,một,41713,1
có bao nhiêu vận động viên trượt tuyết mặc áo khoác vàng nhảy đồng thời,năm,84670,1
những gì chứa đầy rác ở mặt sau,xe tải,519691,0
đứa trẻ với chiếc găng tay chạy ở đâu,đường bộ,185945,3
những gì người lướt sóng dùng để cưởi,diều,578655,0
vợt tennis đã làm ở đâu,văn phòng,411857,3
những gì được chiếu sáng lờ mờ bởi đèn trong góc,phòng,429593,0
có bao nhiêu điện thoại di động trên bàn đá cẩm thạch,năm,152273,1
có bao nhiêu con hươu cao cổ đang đứng cạnh nhau gần một số cây,ba,469392,1
màu của con mèo là gì,màu đen,485044,2
người phụ nữ đang ngồi ở đâu,giường,100798,3
hoa cẩm chướng tươi nằm ở đâu cùng với máy tính,lọ cắm hoa,287841,3
một con voi nâng những gì trong một cánh đồng cỏ,thân cây,399893,0
phương tiện chuyên chở những gì một chiếc xe cổ,xe tải,426372,0
những gì đang lang thang trên cánh đồng cỏ,gấu,471450,0
cái gì đang ngồi trên bàn,hộp,430380,0
gặm cỏ trong cánh đồng mở,ngựa rằn,548722,0
cặp vợ chồng đang cưỡi ngựa là gì,xe máy,540806,0
bông hoa ở đâu,lọ cắm hoa,237851,3
những gì đang đứng trên những tảng đá,gấu,397518,0
cái gì đang ngồi bên cạnh một đống lửa,cây,382533,0
con chó đang ngồi ở đâu,cái ghế,195155,3
người đàn ông và phụ nữ cắt cái gì,bánh,371854,0
đồng hồ vàng được bảo vệ bởi một hộp thủy tinh ở đâu,bảo tàng,171335,3
những gì đang kéo xe lửa trên đường ray,động cơ,511153,0
có bao nhiêu con hươu cao cổ đang ăn cùng nhau trên một bãi đất trống,bốn,437510,1
màu của gấu là gì,màu đen,309660,2
người chuẩn bị hotdogs ở đâu,cái rổ,268072,3
màu của thức ăn là gì,màu trắng,364549,2
những gì đang kéo một cỗ xe đứng trên đường bên cạnh một cái giếng,con ngựa,572861,0
những gì bên cạnh một khu rừng xanh tươi tốt,ngựa rằn,419371,0
có bao nhiêu quả cam đang ngồi trên đầu máy ép trái cây,bốn,153162,1
người đàn ông với nhẫn cưới chụp ảnh ở đâu,gương,255804,3
có bao nhiêu con hươu cao cổ đang đứng cùng nhau trên cánh đồng với hai con tê giác ở phía sau,ba,414850,1
con mèo đang nằm ở đâu,chậu,543264,3
có bao nhiêu người đàn ông mỉm cười khi họ chơi nintendo wii,ba,492692,1
người đàn ông đang chụp ảnh tự sướng ở đâu,phòng tắm,354409,3
màu sắc của gót chân là gì,màu đỏ,303047,2
màu của quả táo là gì,màu xanh lá,510596,2
cái gì in bóng dưới ánh mặt trời,máy bay,480223,0
con bò đang ăn cái gì,bãi cỏ,572069,0
những gì chứa đầy croissant với hotdogs ở giữa,cái mâm,538236,0
cái gì đậu ở bên đường,xe máy,360342,0
người phụ nữ đứng ở đâu trong khi sử dụng máy tính xách tay,phòng bếp,244646,3
khung cảnh cho thấy mọi người ở đâu,đường phố,488432,3
màu của chiếc đĩa là gì,màu cam,342724,2
những khu vực cỏ trong môi trường sống tự nhiên của mình,con voi,426687,0
có bao nhiêu con bò có sừng cùng nhau gặm cỏ trên cánh đồng,hai,416684,1
màu sắc của bông hoa là gì,màu tía,156326,2
màu của áo là gì,màu đỏ,531423,2
màu của nhà vệ sinh là gì,màu trắng,139482,2
bánh mì sandwich nằm ở đâu,dĩa,52096,3
có bao nhiêu bông hoa nhô ra khỏi thành của một cái bát nhỏ,hai,467082,1
những gì đông đúc với những người đang di chuyển xuống một kênh đào,con thuyền,448849,0
có bao nhiêu người đàn ông mặc đồng phục cầm gậy bóng chày cùng nhau,hai,130807,1
màu sắc của bông hoa là gì,màu tía,500356,2
màu của nón là gì,màu cam,187732,2
có bao nhiêu chế độ xem toàn bộ mặt trước,một,340528,1
người phụ nữ đẩy đầy hoa tổng hợp xuống phố làm gì,xe đạp,340998,0
con chó nhỏ ở đâu,hành lý,380395,3
những gì ở làn đường bên trái của giao thông,xe ô tô,581887,0
những gì nằm trên nhánh mỏng gần quả mọng,con chim,389957,0
màu của phòng ngủ là gì,màu tía,379891,2
cặp vợ chồng đang chơi ở đâu,vườn bách thú,445814,3
cái gì đang đứng trên cánh đồng,con voi,474347,0
màu của đồng hồ là gì,màu trắng,334491,2
hai người và một con chó ở đâu,con thuyền,406938,3
em bé nhỏ nằm ở đâu,vali,151783,3
cái gì đang đậu dưới biển báo duy nhất,xe ô tô,523360,0
người cưỡi ván lướt sóng với cái gì,mái chèo,531018,0
trái cây được đặt ở đâu,bát,482719,3
ba tầng đã làm gì trên một món ăn bạc,bánh,447765,0
có bao nhiêu biển báo đường và biển báo trên cột,một,294431,1
cái gì làm cho nước bắn tung tóe,con thuyền,364299,0
những gì ngồi trên lưu trữ đứng trên một bãi đá,thuyền buồm,402855,0
những gì sắp đặt trên bàn trong một phòng chung,lò vi sóng,349525,0
một nhóm người đang ở đâu,giường,325173,3
có bao nhiêu kiện hành lý xếp chồng lên nhau,năm,411821,1
nơi người đàn ông trượt ván,ga-ra,103613,3
có bao nhiêu người trên một chiếc thuyền nhỏ trong đại dương,bốn,576733,1
màu của băng ghế là gì,màu đen,305019,2
màu của bầu trời là gì,màu xanh dương,177786,2
con mèo trắng cuộn tròn ở đâu,chậu,164094,3
màu của chiếc bình là gì,màu xanh dương,228376,2
cái gì đang nằm xuống đeo một chiếc cà vạt bạc ở cổ,con mèo,337180,0
những gì trong bệnh viện rundown trống rỗng,giường,546649,0
có bao nhiêu máy bay phản lực đang bay trên bầu trời xanh,chín,474670,1
"chuối nướng, bánh mì nướng ở đâu",lò vi sóng,72629,3
những gì đứng đầu với sô cô la và đường bột ngồi trong khay nhựa,donut,553576,0
màu của phòng tắm là gì,màu trắng,250827,2
có bao nhiêu thuyền trên sông với mái chèo ở bên và cây ở phía sau,hai,510293,1
những gì ngồi trên đường ray của họ trong một trạm lờ mờ,xe lửa,411958,0
điều gì nằm trên đầu của nó trên bàn phím máy tính xách tay,con chó,427034,0
cái gì đậu trên ngọn cây trong rừng,con chim,361341,0
một con mèo màu cam và trắng đang ngồi ở đâu,cái ghế,331530,3
có bao nhiêu đĩa tôm hùm chế biến sẵn ngồi gần đồ uống trên bàn ăn tối,hai,471345,1
bánh sandwich được gói ở đâu,giấy bạc,254225,3
có bao nhiêu cô gái nhỏ đang nằm trên giường đọc sách,hai,449852,1
người đàn ông trên nhà vệ sinh uống bia và hút gì,thuốc lá,474095,0
người lính mất điện thoại ở đâu,văn phòng,323789,3
màu của quầy là gì,màu vàng,301888,2
hai con mèo ngồi ở đâu,chậu,386414,3
màu của con chó là gì,màu nâu,505629,2
những gì chứa đầy các thiết bị và các món ăn trên mặt quầy,phòng bếp,521542,0
những gì được kết nối với loa và ổ cứng trên bàn,máy vi tính,405188,0
những gì đang nằm trên mui xe của một chiếc xe màu đen,con mèo,489687,0
những gì đang nằm xuống một món đồ chơi màu xanh giữa hai chân của mình,con chó,463670,0
cái gì đậu so với đồng hồ đậu xe bị chìm trong tuyết,xe đạp,352652,0
màu của bông hoa là gì,màu trắng,95554,2
chó pug đen đang ngồi ở đâu,cái ghế,383658,3
nơi chỉ có một bàn chải đánh răng,tách,46852,3
một loạt các bình hoa được sắp xếp ở đâu,cửa sổ,526732,3
màu sắc của công viên là gì,màu đỏ,120385,2
