question,answer,img_id,type
trên bàn có bao nhiêu chiếc bánh nướng trên các đĩa riêng biệt,ba,74794,1
người đàn ông đang nằm ở đâu,giường,491784,3
"giường 4 trụ, tủ quần áo và giấy dán tường hoa ở đâu",phòng ngủ,228043,3
màu của cây là gì,màu xanh lá,414161,2
có bao nhiêu người đang băng qua đường tại một ngã tư,hai,291503,1
những gì đang bay trên cơ thể của nước,con chim,542234,0
có bao nhiêu con chó đang thư giãn bên cạnh người đàn ông trên một vỉa hè,hai,305247,1
cái gì đang kéo một số toa tàu bên cạnh những cái cây,động cơ,380388,0
những gì chứa đầy trái cây và kem trên bàn,máy xay,501029,0
người đàn ông có râu trông trầm ngâm và mặc những gì,cà vạt,502698,0
màu của nhà vệ sinh là gì,màu trắng,534183,2
màu của bông hoa là gì,màu trắng,6263,2
những gì đang ngồi trên quầy cạnh nhau,chuối,543696,0
bàn này có bao nhiêu ly rượu và một món ăn nhẹ,năm,62038,1
nhà vệ sinh trắng ở đâu,phòng tắm,464602,3
những gì có thể được nhìn thấy trên tất cả các phía của tháp,đồng hồ,526256,0
màu của xe buýt là gì,màu đỏ,444373,2
một người phụ nữ lớn tuổi chuẩn bị thức ăn ở đâu,phòng bếp,11701,3
những gì sẽ nhận được nhiều sử dụng bởi chủ sở hữu của nó,chuột,443723,0
những bông hoa nằm ở đâu,lọ cắm hoa,398270,3
người phụ nữ mỉm cười giữ lấy gì trong không khí,chuối,413295,0
người đàn ông chèo thuyền ở đâu,con thuyền,160307,3
có bao nhiêu con ngỗng trôi giữa sông,bốn,23230,1
màu của tủ lạnh là gì,màu trắng,212181,2
màu của con mèo là gì,màu xám,234217,2
những gì đang ngồi trong một sàn gạch có mái ngói trong một phòng duy nhất,nhà vệ sinh,411943,0
người phụ nữ cưỡi những gì nhảy qua một chướng ngại vật,con ngựa,553990,0
những gì xếp hàng đến đồng tiền mét trên một vỉa hè đông đúc?,xe ô tô,485123,0
những gì nằm trên đỉnh của một chiếc ghế sofa màu đỏ,con chó,553795,0
màu sắc của sự phân tán là gì,màu cam,447099,2
người phụ nữ đeo kính đang làm bữa tối ở đâu,phòng bếp,303431,3
màu của lá là gì,màu xanh lá,357601,2
có bao nhiêu đồng hồ giống hệt nhau đang hiển thị các múi giờ khác nhau,năm,492580,1
một số thực phẩm lành mạnh nằm ở đâu,đĩa ăn,501947,3
người phụ nữ đang cầm gì để phục vụ bóng,vợt,397101,0
những gì nằm trên băng ghế gỗ bên cạnh một quả bí ngô,con chó,391139,0
những gì được tạo thành từ thịt và rau,món ăn,523560,0
những gì trên đường ray xe lửa gần một cụm tòa nhà nhỏ,tàu hỏa,461628,0
màu của gấu là gì,màu nâu,519911,2
màu của container là gì,màu xanh dương,195969,2
có bao nhiêu chàng trai đứng cạnh một biển báo dừng lại,ba,239803,1
có bao nhiêu con cừu đang chăn thả trên đồng cỏ gần hàng rào dây thép,hai,149253,1
màu của gấu là gì,màu đen,311953,2
cái gì đang di chuyển trên một bộ đường ray,tàu hỏa,574856,0
cái gì đậu trong bãi đậu xe,xe buýt,359937,0
con mèo đứng ở đâu,chậu,227044,3
những gì trong chiếc bình trên đỉnh của một bảng dưới một số hình ảnh,bông hoa,480664,0
những gì đang chơi trên băng,gấu,499104,0
đàn ông và phụ nữ cắt những gì cùng nhau,bánh,371854,0
có bao nhiêu cô gái xinh đẹp đứng cạnh nhau,bốn,131366,1
ba người tìm kiếm gì khi ngồi ở bàn,điện thoại,537270,0
đứa trẻ đang đứng đâu,xe điện ngầm,215469,3
có bao nhiêu đứa trẻ đeo găng tay bóng chày ở sân cỏ,ba,413182,1
màu của bìa là gì,màu xanh lá,124606,2
những gì tạo nên màn hình đẹp,ván lướt sóng,378701,0
màu của áo là gì,màu nâu,302932,2
đàn bò đứng ở đâu,đường bộ,157792,3
cái gì mà chục chiếc bánh rán ngồi trong hộp bánh rán,sô cô la,377814,0
có bao nhiêu chiếc lọ xanh xếp trên tường,ba,485890,1
màu của con chó là gì,màu đen,383658,2
đóng lên bàn phím apple và những gì,chuột,417804,0
có bao nhiêu người tụ tập quanh bàn và mỉm cười cho bức tranh,bốn,507154,1
người đàn ông ở đâu,nhà vệ sinh,505385,3
màu của con ngựa là gì,màu nâu,378491,2
những gì đang đứng ngoài nước trong khi những người khác ở trong,con voi,384718,0
hai người xem những gì bay trên một cánh đồng cỏ,diều,470766,0
đám trẻ đang ăn pizza ở đâu,quán ăn,210845,3
màu của chiếc giường là gì,màu xanh dương,374133,2
có bao nhiêu con bò đang ngồi trên cỏ dưới gốc cây,hai,452772,1
có bao nhiêu thanh niên đeo kính râm trên thuyền buồm,năm,450832,1
có bao nhiêu tay đua mô tô trên đường đua sắp rẽ,ba,345608,1
những gì bên cạnh nhau trên một tầng trong nhà,ván trượt,430096,0
người phụ nữ đang làm bánh rán tươi ở đâu,phòng bếp,105531,3
có bao nhiêu chiếc bánh pizza cỡ cá nhân trên bàn,ba,485288,1
những gì nằm xuống bên cạnh máy tính xách tay,con mèo,493295,0
có bao nhiêu con hươu cao cổ trong tự nhiên trên một cánh đồng cỏ,hai,163104,1
cái gì nằm trên chiếc gối trên chiếc giường không được dọn sẵn,gấu,341957,0
màu của lá là gì,màu xanh lá,94293,2
màu của chiếc bình là gì,màu trắng,436693,2
màu của con mèo là gì,màu đen,68136,2
màu của chiếc bình là gì,màu tía,473018,2
màu của bầu trời là gì,màu xanh dương,73244,2
dấu hiệu dừng màu đỏ ở đâu,cái rổ,120032,3
có bao nhiêu người trượt tuyết chuẩn bị trượt tuyết và tạo dáng trước ống kính,ba,231028,1
những gì chứa đầy các mặt hàng câu cá khi đậu ở bến tàu,con thuyền,575441,0
có bao nhiêu người lướt sóng bước ra nước vào lúc hoàng hôn,bốn,374848,1
những gì đứng đầu với sô cô la và đường bột ngồi trong khay nhựa,donut,553576,0
người đàn ông trên máy tính xách tay trong khi có bao nhiêu con mèo ngồi với anh ta,hai,436014,1
màu của con ngựa là gì,màu nâu,330516,2
có bao nhiêu cái bánh mì nướng đang ngồi trên đĩa uống nước,hai,284008,1
những tờ giấy được đánh số ở đâu,phòng bếp,417885,3
máy sấy tóc đen đang ở đâu,cái ghế,355124,3
bồn tắm ngồi ở đâu,phòng tắm,292818,3
con mèo trắng đứng ở đâu,cây,310928,3
hai người đàn ông nằm ở đâu,giường,261879,3
"ngô và những người ăn khác ở đâu, và một chai và ly rượu vang gần nó",đĩa ăn,257955,3
màu của lá là gì,màu xanh lá,327738,2
màu của sàn là gì,màu xanh lá,158569,2
"những gì chứa thịt phủ với nước sốt, bí đao, khoai tây nghiền và bông cải xanh",đĩa ăn,452931,0
người phụ nữ ở đâu,phòng bếp,548118,3
màu của vùng nước là gì,màu xanh dương,9771,2
có bao nhiêu màn hình hiển thị hai cặp cánh độc đáo,hai,56960,1
người đàn ông cưỡi những gì trên một bên đất liền,ván trượt,443065,0
màu của các container là gì,màu vàng,575199,2
có bao nhiêu con voi xám đứng trước bức tường xi măng,hai,364683,1
màu của con voi là gì,màu xám,278870,2
điều gì đang theo dõi người đàn ông vào một cửa hàng,con chó,496897,0
những gì nghiêng qua trong cánh đồng sang trọng bên cạnh một số con nai,hươu cao cổ,459757,0
có bao nhiêu con mèo đứng trong bồn rửa trong khi con kia ngủ trong toilet,một,473500,1
màu của con chó là gì,màu nâu,334616,2
giường tầng gỗ được đặt ở đâu,hành lang,159974,3
màu của gối là gì,màu đỏ,35573,2
cái gì trên bàn máy tính với một tách cà phê,máy vi tính,482974,0
bức ảnh chụp qua kính chắn gió ô tô ở đâu cho thấy một chiếc ô tô trên đường cao tốc và một người phụ nữ,gương,515430,3
màu của hàng rào là gì,màu cam,201000,2
có bao nhiêu xe tải đậu thành hàng trên đường phố,ba,434991,1
những gì được dán nhãn là `` ngựa '' ổ đĩa xuống một con đường,xe tải,403919,0
những gì đang được nấu trong một lò nướng với một cánh cửa rõ ràng,pizza,453317,0
hai người ngồi trên bàn gỗ cạnh nhau làm gì,máy tính,374333,0
người đang xén lông cừu ở đâu,quả bóng,357117,3
món gà tây sống ở đâu,lò vi sóng,131832,3
cái gì đang ngồi trên tay lái của một chiếc xe đạp,cừu,555687,0
đĩa giữ những gì với cà chua và hành tây,bánh hamburger,487295,0
người đàn ông đang ngồi ở đâu,xe ô tô,389577,3
màu sắc của quần áo là gì,màu cam,565081,2
cây hoặc thực vật ở đâu,sân vườn,115475,3
con mèo lớn nằm ở đâu,vali,460505,3
những gì nuôi con chim của cô ấy bởi tổ,con chim,409701,0
những gì đang đi trong bụi bẩn,ngựa rằn,447194,0
màu của ghế là gì,màu xanh dương,299647,2
màu của khoảng sân là gì,màu xanh lá,531266,2
màu của xe buýt là gì,màu xanh dương,400091,2
ngũ cốc ở đâu cạnh chiếc bánh rán sô cô la trên đĩa,bát,364364,3
những gì nằm bên cạnh một số đèn đường,tòa nhà,459987,0
làm gì hai con voi nhốt nhau trong khu vực bàn chải,xe tải,562595,0
trẻ mới biết đi ở đâu khi sử dụng nhà vệ sinh,phòng tắm,175476,3
một số con ngựa rất lớn kéo những gì tải với thùng,toa xe,459117,0
những gì đứng trong cánh đồng được bao quanh bởi rừng trong một sở thú,hươu cao cổ,460379,0
những gì đã sơn màu đỏ và vàng trên đường phố,vòi,344909,0
có bao nhiêu con ngựa vằn đang gặm cỏ trên một bãi cỏ rộng mở,hai,405778,1
có bao nhiêu người trượt tuyết trong bộ đồ trượt tuyết,ba,489850,1
màu của cái bát là gì,màu xanh dương,119870,2
cái gì đang đỗ trên đường băng trong một bức tranh đen trắng,máy bay,443737,0
cái gì đang đỗ trên đường lái xe râm mát,toa xe,472598,0
bàn máy tính ở đâu trước cửa sổ,văn phòng,116570,3
con hươu cao cổ đi lang thang xung quanh cái gì và ăn từ máng trên tường,lồng,389721,0
"cái gì có thức ăn với bông cải xanh, cá và khoai tây nướng",đĩa ăn,478766,0
màu của áo là gì,màu tía,177840,2
nhiều những gì đang ngồi trên đỉnh của một quầy gỗ bên cạnh đám đông người,pizza,416335,0
bông hoa màu xanh bên cạnh quả lê ở đâu,lọ cắm hoa,228376,3
những gì đỗ trên đường phố,xe đẩy,575406,0
"những gì đứng gắn liền với xe ngựa, bị một người phụ nữ chạm vào",con ngựa,430788,0
có bao nhiêu nửa con đường bị đóng lại trong quá trình sửa chữa đường,một,52382,1
màu của chiếc tàu là gì,màu đỏ,80283,2
cửa sổ nào phản chiếu các tòa nhà thành phố khác trong nền; phía trước có đèn giao thông,tòa nhà,447842,0
màu của điều khiển từ xa là gì,màu trắng,488605,2
người đàn ông và phụ nữ đi xe bên cạnh một cơ thể của nước,con voi,548420,0
người chơi tennis sử dụng cái gì để đánh bóng,vợt,579060,0
ghế ngồi ở đâu,phòng,578843,3
bao nhiêu thanh niên mặc vest đứng gần nhau,bốn,392664,1
con mèo xám nằm cuộn tròn ở đâu,cái rổ,419273,3
mèo đen và nâu ngồi ở đâu,balo,550030,3
màu của dĩa nhựa là gì,màu xanh lá,368435,2
có bao nhiêu người đàn ông đang đứng trong công viên khi nói chuyện với nhau,ba,145528,1
một người đàn ông giữ cái gì,máy ảnh,366104,0
những gì bị kẹt trong giao thông,xe buýt,403657,0
người phụ nữ cầm cái gì và mỉm cười trong phòng tắm,bàn chải,351133,0
trẻ nhỏ đứng ở công viên trượt băng làm gì,xe đạp,361472,0
đồng hồ này cũng có những gì bên cạnh nó,lá cờ,511379,0
người đàn ông trẻ đang ngồi xuống đâu,phòng,121420,3
ba người mặc trang phục rằn ri của quân đội đang cắt những gì,bánh,506458,0
con mèo đang ở đâu thoải mái,vali,64423,3
có bao nhiêu bông hoa riêng lẻ trong một cái bình,ba,146997,1
những gì cất cánh tại sân bay lớn,máy bay,503292,0
có bao nhiêu ngã tư với tháp đồng hồ ở giữa,bốn,466536,1
những gì dừng trên đường phố,xe buýt,449031,0
nhảy ra khỏi cành là gì,con chim,498381,0
hai con mèo ngồi ở đâu,chậu,386414,3
bốn người đàn ông đang lập văn phòng và ăn gì vậy,bữa trưa,365626,0
có bao nhiêu người đang đi xuống lối đi bộ lót ván với ô,ba,149230,1
những gì trong chảo trên lò nướng,pizza,561004,0
con chó nằm ở đâu,cái ghế,581097,3
màu của tòa nhà là gì,màu nâu,157604,2
những gì ăn cỏ trong hàng rào,con bò,576200,0
màu của bồn là gì,màu trắng,488295,2
những gì bay trên bầu trời đầy mây,máy bay,532338,0
con mèo nằm ở đâu,chậu,543264,3
những gì đứng trên một vỉa hè trống rỗng,đồng hồ,460149,0
em bé đang nằm trên nó là gì,bàn chải,462890,0
màu sắc của áo khoác là gì,màu đen,465229,2
có bao nhiêu người ngồi quanh chiếc bàn gỗ trong khi một người phụ nữ đứng dang rộng cánh tay,ba,267216,1
con mèo ngồi ở đâu,giường,182758,3
người giữ những gì với chân trên máy tính xách tay,con chó,561411,0
màu của hàng rào là gì,màu cam,396494,2
những gì đang ngồi bên cạnh lò sưởi trong nhà của người nào đó,cái ghế,349321,0
những gì được trang trí với hoa thật trên một cái bánh đứng,bánh,507951,0
bên cạnh một quả chuối chứa đầy thức ăn thừa,bát,348708,0
những gì đang diễn ra trên con đường của một thành phố tắc nghẽn và đồi núi,xe buýt,413339,0
người phụ nữ đang ngồi ở đâu,cái ghế,308936,3
cà chua đã nấu gì trên bàn gỗ,pizza,535933,0
chuối và cam được đặt cùng với những con bướm trên cái gì,đĩa ăn,383341,0
cửa mở ở đâu để lộ một nhà vệ sinh,phòng,156739,3
một nhà bếp trống với một cái bếp màu trắng,lò vi sóng,545101,0
những gì đứng trước một người đàn ông,con dê,569849,0
có bao nhiêu con chim đậu trên vỉa hè trong khi những con khác đứng xem,một,198406,1
màu của nước ép là gì,màu cam,357810,2
có bao nhiêu con chim đứng trên cát gần một vùng nước,năm,7048,1
đội trượt tuyết đang cưỡi lên bờ tuyết bao nhiêu bên,một,83858,1
"những gì rất tối, chuỗi để xả bồn cầu nằm trên tường",phòng tắm,409500,0
những gì được đẩy lên chống lại nhau,giường,483531,0
màu sắc của bông hoa là gì,màu xanh lá,351591,2
có bao nhiêu con gấu nâu đang nằm trên một tảng đá và một con gấu khác đang đi dạo,một,295370,1
gấu bông được để ở đâu,toa xe,186997,3
có một cây cổ thụ ở đâu,vườn bách thú,428837,3
màu của xe máy là gì,màu xanh lá,8944,2
"những chiếc buồng nào với bàn, máy tính xách tay và máy tính để bàn",văn phòng,427306,0
màu của thoete là gì,màu tía,230109,2
tủ đông tủ lạnh đang ở đâu,phòng bếp,404191,3
bông cải xanh và xúc xích ở đâu,món ăn,490118,3
người phụ nữ đặt hàng ở đâu,quán ăn,480121,3
những gì giữ tàu và một ngọn hải đăng,bến du thuyền,539557,0
màu của dĩa nhựa là gì,màu đỏ,541944,2
màu của vật trang trí là gì,màu cam,222970,2
người đàn ông cầm những gì phản chiếu trong một tấm gương phòng tắm ,máy ảnh,383606,0
những gì chứa đầy rau và thịt ngồi trên một cái bọc bạc,sandwich,494747,0
màu của con voi là gì,màu nâu,245746,2
những gì cho thấy phòng tắm lát gạch với một bồn rửa và nhà vệ sinh,ảnh chụp,436848,0
màu của chiếc tàu là gì,màu đỏ,304040,2
con hươu cao cổ băng qua và đi khỏi cây là gì,đường bộ,426948,0
có bao nhiêu phụ nữ ngồi trên băng ghế công viên với cửa hàng tạp hóa,bốn,549599,1
những gì đỗ bên cạnh bến thuyền với những người đứng trên đó,xe đạp,388619,0
những gì nhìn vào máy ảnh trong khi ngồi trên đi văng,con chó,490284,0
đua xe máy đi quanh một đường cong ở đâu,đường,112841,3
những gì đang đi qua cỏ cao trong một đầm lầy,con chim,442968,0
những gì đang ngồi dưới cỗ xe bên ngoài,lọ cắm hoa,549300,0
màu của xe máy là gì,màu đen,351298,2
người đang chờ tàu ở đâu,trạm,189798,3
người đàn ông mang theo gì,vali,422836,0
màu của chiếc ô là gì,màu tía,7642,2
nấu pizza ở đâu,lò vi sóng,228382,3
bàn với hai màn hình máy tính được nhìn thấy ở đâu,phòng ngủ,397253,3
người đàn ông lớn đang giữ gì,vali,449191,0
những gì ngồi trên ghế trước máy tính xách tay,gấu,402858,0
màu của bệ là gì,màu nâu,114219,2
ba quả chuối chín nằm ở đâu,bát,491029,3
có bao nhiêu con hươu cao cổ đang ăn cùng nhau trên một bãi đất trống,bốn,437510,1
lưng của một người đứng đầu ở đâu,xe đẩy,294426,3
có bao nhiêu hình ảnh món ăn với thức ăn trong đó,bốn,200978,1
có bao nhiêu con ngựa đang ăn thịt trên mặt đất trên đồng cỏ,hai,367579,1
những gì nhìn vào nhau trước cửa sổ,con mèo,572184,0
một con voi đi về phía máy ảnh ở đâu,vườn bách thú,402357,3
những gì nằm trên vỉa hè thành phố,băng ghế,491131,0
gương và một số cành cây trên tủ quần áo ở đâu,lọ cắm hoa,449693,3
cái gì bên cạnh bức tường màu vàng,vòi,348648,0
có bao nhiêu người đàn ông đang làm việc trên mái tóc của một người phụ nữ,hai,545944,1
có bao nhiêu nhà vệ sinh đối diện nhau với rào cản riêng tư,hai,115709,1
màu của khay là gì,màu vàng,448161,2
con chó đang ngủ ở đâu,giường,345238,3
người phụ nữ sử dụng máy tính xách tay ở đâu,giường,168650,3
hai con mèo nhìn ra những gì đang ngồi trên tấm thảm sọc,cửa sổ,449660,0
những gì đang đứng trong rừng,con chim,453330,0
những gì được hiển thị vận chuyển lô hàng xe đạp,phương tiện giao thông,551952,0
cái gì đang đỗ bên đường,xe tải,577223,0
cái gì đang cúi mình trên bãi cát trước hàng cây,hươu cao cổ,564142,0
những gì lái xuống phố trong một thành phố,xe máy,487688,0
người đàn ông ở đâu,gương,422375,3
những gì nằm trên tấm chăn được bao quanh bởi những con vật nhồi bông,con mèo,480593,0
những gì nằm trên bờ hồ,con thuyền,561270,0
con mèo đang nằm ở đâu,giường,34415,3
những gì ăn cỏ bên cạnh làng teton,con ngựa,380892,0
bếp gỗ cũ ở đâu,phòng bếp,341894,3
những gì bị chặn một phần bởi cửa gấp,tủ lạnh,575356,0
có bao nhiêu con ngựa vằn trong một ngôi nhà có tường bao quanh bằng đá với những cái cây nhỏ trong đó,hai,197401,1
màu của vòi nước là gì,màu cam,353912,2
bánh sandwich thịt và phô mai được phục vụ ở đâu,cái rổ,185577,3
màu của dĩa nhựa là gì,màu vàng,318529,2
những gì đang ngồi trên cỏ trong một bao vây,con bò,502798,0
cái gì đang ngồi trên boong,con mèo,360943,0
"có bao nhiêu người đang ngồi trên chiếc ca nô, với người thứ ba từ chèo trước",bốn,456245,1
nửa cái bánh mì kẹp và mấy trái nho lót giấy ở đâu,cái rổ,536535,3
có bao nhiêu đứa trẻ đang ngồi trên một chiếc ghế dài,ba,94837,1
phòng ngủ nằm ở đâu,tòa nhà,300882,3
có bao nhiêu người trong dãy phòng đang đặt ra sau một số bát phục vụ,hai,30387,1
xe buýt xanh hai tầng dừng ở đâu,ga-ra,488932,3
màu của bầu trời là gì,màu xanh dương,243895,2
màu của dĩa nhựa là gì,màu vàng,491989,2
những gì trên vỉa hè tại sân bay,máy bay,413734,0
cái gì chứa 3 màn hình và một máy tính xách tay,cái bàn,364444,0
người đàn ông cưỡi những gì trên mặt đất phủ tuyết,ván trượt,505156,0
người đang cưỡi cái gì xuống một đoạn đường dốc phủ đầy tuyết,trượt tuyết,364884,0
ba quả chanh nằm ở đâu,bát,254197,3
gấu nhồi bông được đặt ở đâu,cái rổ,545364,3
màu của lửa là gì,màu đỏ,137745,2
những gì được phản ánh trong gương chiếu hậu của một chiếc xe hơi,bầu trời,473050,0
có bao nhiêu người chơi nintendo wii trên tivi,hai,462037,1
màu của xe buýt là gì,màu vàng,472089,2
màu của con chim là gì,màu vàng,74828,2
màu của bánh là gì,màu trắng,70380,2
bánh rán xanh và các món khác đãi ở đâu,hộp,572474,3
có bao nhiêu đứa trẻ trong hai trường hợp quần áo,hai,377339,1
bức ảnh đen trắng này hiển thị gì với bồn rửa và nhà vệ sinh,phòng tắm,436848,0
có bao nhiêu con chim đang bay trên bầu trời quang đãng,ba,438091,1
màu của con gấu là gì,màu nâu,318811,2
màu của cái bát là gì,màu xanh lá,518807,2
"có bao nhiêu người đàn ông mặc vest đứng cạnh nhau, cả hai đều cầm ô có đèn",hai,23117,1
cái gì ở đó chứa đầy chất lỏng và chất rắn không xác định,cái lọ,352794,0
một số hành tây ở đâu,cái thìa,5600,3
những gì chứa đầy đồ nội thất và một cửa sổ được bao phủ trong rèm cửa,phòng,402639,0
những gì được hiển thị với máy tính xách tay,cái bàn,444682,0
màu của bếp là gì,màu vàng,111152,2
con mèo đang nằm ở đâu,giường,311167,3
những gì bên cạnh lò vi sóng và một máy rửa chén,tủ đá,499480,0
màu của gấu là gì,màu đen,222122,2
người phụ nữ đang làm việc ở đâu,phòng bếp,368474,3
người đàn ông đang làm việc ở đâu,phòng bếp,334098,3
hai người phụ nữ giữ gì trong khi chờ đợi để băng qua đường trong một thành phố,chiếc ô,413689,0
những gì nằm trên miếng lót chuột bên cạnh ipod,chuột,568982,0
người phụ nữ giữ bàn chải đánh răng ở đâu,cửa hàng,88514,3
những gì đang kéo vào nhà ga,tàu hỏa,411958,0
có bao nhiêu con voi đang đi bên cạnh một bức tường đá có cây sơn trên đó,hai,232618,1
những gì đang đi xuống rãnh lưới đến một cây cầu,tàu hỏa,419096,0
cái gì đang đậu trên băng ghế bên một ít nước,con chim,484026,0
"những gì mở tiết lộ nhà vệ sinh, bồn rửa và tủ treo",cửa,416745,0
người trượt ván đang lật một ván trượt ở đâu,đường phố,320117,3
người đàn ông sử dụng bao nhiêu máy tính xách tay cho mỗi máy tính trẻ em,một,356569,1
con gấu bông lớn màu nâu với đôi mắt đen đang ngồi ở đâu,cái ghế,11222,3
có bao nhiêu người đang tạo dáng trên sân tennis,ba,217463,1
màu của con mèo là gì,màu đen,280866,2
màu của xe buýt là gì,màu xanh lá,342591,2
người đàn ông nằm ở đâu,giường,336735,3
màu của chiếc tàu là gì,màu đỏ,393617,2
cô gái trẻ xinh đẹp đung đưa những gì,vợt,563927,0
những gì đang rơi ra khỏi người chơi đang cầm một cây vợt tennis,mũ lưỡi trai,525908,0
có bao nhiêu người đàn ông đang ngồi trên chiếc ghế đẩu,một,495124,1
phụ nữ đang nằm ở đâu,giường,325173,3
người đàn ông mặc vest và đeo cà vạt là gì,nước,347254,0
màu của thân cây là gì,màu xanh dương,252868,2
"có bao nhiêu bánh tét với thịt, đậu, phô mai, ớt jalapeno, hành tây, ớt xanh, ớt đỏ và kem chua",hai,425263,1
những gì nằm trên bụi bẩn gần một số nước,con voi,498383,0
người đàn ông đang chụp gì với một chiếc máy ảnh nhỏ,bức ảnh,340209,0
những gì đang đội mũ,vòi,558107,0
một loạt các bình hoa được sắp xếp ở đâu,cửa sổ,526732,3
có bao nhiêu con gấu bông được ghim vào dây phơi bằng ghim quần áo,bốn,316937,1
những đứa trẻ ngựa vằn ở đâu,chuồng,126486,3
có bao nhiêu con hươu cao cổ nằm úp mặt xuống đất ngủ,hai,418596,1
những gì đang đi dạo trong vùng hoang dã,con voi,381914,0
những gì chứa nhiều rau,đĩa ăn,528866,0
màu của con chim là gì,màu xám,141063,2
hai người đàn ông trong trang phục ăn bánh rán,cửa hàng,269004,3
màu của con chó là gì,màu nâu,505629,2
